Electron and thermal transport via Variable Range Hopping in MoSe$_{2}$ single crystals,"Bulk single crystal Molybdenum diselenide has been studied for its electronic and thermal transport properties. We perform resistivity measurements with current in-plane (CIP) and current perpendicular to plane (CPP) as a function of temperature. The CIP measurements exhibit metal to semiconductor transition at $\simeq 31$ K. In the semiconducting phase ($T > 31$ K), the transport is best explained by variable range hopping (VRH) model. Large magnitude of resistivity in CPP mode indicates strong structural anisotropy. Seebeck coefficient as a function of temperature measured in the range $90 - 300$ K, also agrees well with the VRH model. The room temperature Seebeck coefficient is found to be $139$ $\mu$V/K. VRH fittings of the resistivity and Seebeck coefficient data indicate high degree of localization."
Ball in double hoop: demonstration model for numerical optimal control,"  Ball and hoop system is a well-known model for the education of linear control systems. In this paper, we have a look at this system from another perspective and show that it is also suitable for demonstration of more advanced control techniques. In contrast to the standard use, we describe the dynamics of the system at full length; in addition to the mode where the ball rolls on the (outer) hoop we also consider the mode where the ball drops out of the hoop and enters a free-fall mode. Furthermore, we add another (inner) hoop in the center upon which the ball can land from the free-fall mode. This constitutes another mode of the hybrid description of the system. We present two challenging tasks for this model and show how they can be solved by trajectory generation and stabilization. We also describe how such a model can be built and experimentally verify the validity of our approach solving the proposed tasks. "
Forecasting market states,"  We propose a novel methodology to define, analyse and forecast market states. In our approach market states are identified by a reference sparse precision matrix and a vector of expectation values. In our procedure each multivariate observation is associated to a given market state accordingly to a penalized likelihood maximization. The procedure is made computationally very efficient and can be used with a large number of assets. We demonstrate that this procedure successfully classifies different states of the markets in an unsupervised manner. In particular, we describe an experiment with one hundred log-returns and two states in which the methodology automatically associates one state to periods with average positive returns and the other state to periods with average negative returns, therefore discovering spontaneously the common classification of `bull' and `bear' markets. In another experiment, with again one hundred log-returns and two states, we demonstrate that this procedure can be efficiently used to forecast off-sample future market states with significant prediction accuracy. This methodology opens the way to a range of applications in risk management and trading strategies where the correlation structure plays a central role. "
Planetary Ring Dynamics -- The Streamline Formalism -- 2. Theory of Narrow Rings and Sharp Edges,"The present material covers the features of large scale ring dynamics in perturbed flows that were not addressed in part 1 (astro-ph/1606.00759); this includes an extensive coverage of all kinds of ring modes dynamics (except density waves which have been covered in part 1), the origin of ring eccentricities and mode amplitudes, and the issue of ring/gap confinement. This still leaves aside a number of important dynamical issues relating to the ring small scale structure, most notably the dynamics of self-gravitational wakes, of local viscous overstabilities and of ballistic transport processes. As this material is designed to be self-contained, there is some 30% overlap with part 1. This work constitutes a preprint of Chapter 11 of the forthcoming Cambridge University book on rings (Planetary Ring Systems, Matt Tiscareno and Carl Murray, eds)."
Parallel Streaming Wasserstein Barycenters,"  Efficiently aggregating data from different sources is a challenging problem, particularly when samples from each source are distributed differently. These differences can be inherent to the inference task or present for other reasons: sensors in a sensor network may be placed far apart, affecting their individual measurements. Conversely, it is computationally advantageous to split Bayesian inference tasks across subsets of data, but data need not be identically distributed across subsets. One principled way to fuse probability distributions is via the lens of optimal transport: the Wasserstein barycenter is a single distribution that summarizes a collection of input measures while respecting their geometry. However, computing the barycenter scales poorly and requires discretization of all input distributions and the barycenter itself. Improving on this situation, we present a scalable, communication-efficient, parallel algorithm for computing the Wasserstein barycenter of arbitrary distributions. Our algorithm can operate directly on continuous input distributions and is optimized for streaming data. Our method is even robust to nonstationary input distributions and produces a barycenter estimate that tracks the input measures over time. The algorithm is semi-discrete, needing to discretize only the barycenter estimate. To the best of our knowledge, we also provide the first bounds on the quality of the approximate barycenter as the discretization becomes finer. Finally, we demonstrate the practical effectiveness of our method, both in tracking moving distributions on a sphere, as well as in a large-scale Bayesian inference task. "
Lecar's visual comparison method to assess the randomness of Bode's law: an answer,The usual main objection against any attempt in finding a physical cause for the planet distance distribution is based on the assumption that similar distance distribution could be obtained by sequences of random numbers. This assumption was stated by Lecar in an old paper (1973). We show here how this assumption is incorrect and how his visual comparison method is inappropriate.
GoDP: Globally optimized dual pathway system for facial landmark localization in-the-wild,"Facial landmark localization is a fundamental module for pose-invariant face recognition. The most common approach for facial landmark detection is cascaded regression, which is composed of two steps: feature extraction and facial shape regression. Recent methods employ deep convolutional networks to extract robust features for each step, while the whole system could be regarded as a deep cascaded regression architecture. In this work, instead of employing a deep regression network, a Globally Optimized Dual-Pathway (GoDP) deep architecture is proposed to identify the target pixels through solving a cascaded pixel labeling problem without resorting to high-level inference models or complex stacked architecture. The proposed end-to-end system relies on distance-aware softmax functions and dual-pathway proposal-refinement architecture. Results show that it outperforms the state-of-the-art cascaded regression-based methods on multiple in-the-wild face alignment databases. The model achieves 1.84 normalized mean error (NME) on the AFLW database, which outperforms 3DDFA by 61.8%. Experiments on face identification demonstrate that GoDP, coupled with DPM-headhunter, is able to improve rank-1 identification rate by 44.2% compared to Dlib toolbox on a challenging database."
"A function with support of finite measure and ""small"" spectrum",  We construct a function on the real line supported on a set of finite measure whose spectrum has density zero. 
Cell growth rate dictates the onset of glass to fluid-like transition and long time super-diffusion in an evolving cell colony,"Collective migration dominates many phenomena, from cell movement in living systems to abiotic self-propelling particles. Focusing on the early stages of tumor evolution, we enunciate the principles involved in cell dynamics and highlight their implications in understanding similar behavior in seemingly unrelated soft glassy materials and possibly chemokine-induced migration of CD8$^{+}$ T cells. We performed simulations of tumor invasion using a minimal three dimensional model, accounting for cell elasticity and adhesive cell-cell interactions as well as cell birth and death to establish that cell growth rate-dependent tumor expansion results in the emergence of distinct topological niches. Cells at the periphery move with higher velocity perpendicular to the tumor boundary, while motion of interior cells is slower and isotropic. The mean square displacement, $\Delta(t)$, of cells exhibits glassy behavior at times comparable to the cell cycle time, while exhibiting super-diffusive behavior, $\Delta (t) \approx t^{\alpha}$ ($\alpha > 1$), at longer times. We derive the value of $\alpha \approx 1.33$ using a field theoretic approach based on stochastic quantization. In the process we establish the universality of super-diffusion in a class of seemingly unrelated non-equilibrium systems. Super diffusion at long times arises only if there is an imbalance between cell birth and death rates. Our findings for the collective migration, which also suggests that tumor evolution occurs in a polarized manner, are in quantitative agreement with {\it in vitro} experiments. Although set in the context of tumor invasion the findings should also hold in describing collective motion in growing cells and in active systems where creation and annihilation of particles play a role."
Distributed Average Tracking for Lipschitz-Type Nonlinear Dynamical Systems,"  In this paper, a distributed average tracking problem is studied for Lipschitz-type nonlinear dynamical systems. The objective is to design distributed average tracking algorithms for locally interactive agents to track the average of multiple reference signals. Here, in both the agents' and the reference signals' dynamics, there is a nonlinear term satisfying the Lipschitz-type condition. Three types of distributed average tracking algorithms are designed. First, based on state-dependent-gain designing approaches, a robust distributed average tracking algorithm is developed to solve distributed average tracking problems without requiring the same initial condition. Second, by using a gain adaption scheme, an adaptive distributed average tracking algorithm is proposed in this paper to remove the requirement that the Lipschitz constant is known for agents. Third, to reduce chattering and make the algorithms easier to implement, a continuous distributed average tracking algorithm based on a time-varying boundary layer is further designed as a continuous approximation of the previous discontinuous distributed average tracking algorithms. "
On the Möbius Function and Topology of General Pattern Posets,"  We introduce a formal definition of a pattern poset which encompasses several previously studied posets in the literature. Using this definition we present some general results on the Möbius function and topology of such pattern posets. We prove our results using a poset fibration based on the embeddings of the poset, where embeddings are representations of occurrences. We show that the Möbius function of these posets is intrinsically linked to the number of embeddings, and in particular to so called normal embeddings. We present results on when topological properties such as Cohen-Macaulayness and shellability are preserved by this fibration. Furthermore, we apply these results to some pattern posets and derive alternative proofs of existing results, such as Björner's results on subword order. "
A Potapov-type approach to a truncated matricial Stieltjes-type power moment problem,  The paper gives a parametrization of the solution set of a matricial Stieltjes-type truncated power moment problem in the non-degenerate and degenerate cases. The key role plays the solution of the corresponding system of Potapov's fundamental matrix inequalities. 
The scaling limit of the KPZ equation in space dimension 3 and higher,"We study in the present article the Kardar-Parisi-Zhang (KPZ) equation $$ \partial_t h(t,x)=\nu\Delta h(t,x)+\lambda |\nabla h(t,x)|^2 +\sqrt{D}\, \eta(t,x), \qquad (t,x)\in\mathbb{R}_+\times\mathbb{R}^d $$ in $d\ge 3$ dimensions in the perturbative regime, i.e. for $\lambda>0$ small enough and a smooth, bounded, integrable initial condition $h_0=h(t=0,\cdot)$. The forcing term $\eta$ in the right-hand side is a regularized space-time white noise. The exponential of $h$ -- its so-called Cole-Hopf transform -- is known to satisfy a linear PDE with multiplicative noise. We prove a large-scale diffusive limit for the solution, in particular a time-integrated heat-kernel behavior for the covariance in a parabolic scaling. The proof is based on a rigorous implementation of K. Wilson's renormalization group scheme. A double cluster/momentum-decoupling expansion allows for perturbative estimates of the bare resolvent of the Cole-Hopf linear PDE in the small-field region where the noise is not too large, following the broad lines of Iagolnitzer-Magnen. Standard large deviation estimates for $\eta$ make it possible to extend the above estimates to the large-field region. Finally, we show, by resumming all the by-products of the expansion, that the solution $h$ may be written in the large-scale limit (after a suitable Galilei transformation) as a small perturbation of the solution of the underlying linear Edwards-Wilkinson model ($\lambda=0$) with renormalized coefficients $\nu_{eff}=\nu+O(\lambda^2),D_{eff}=D+O(\lambda^2)$."
Beyond Free Riding: Quality of Indicators for Assessing Participation in Information Sharing for Threat Intelligence,"  Threat intelligence sharing has become a growing concept, whereby entities can exchange patterns of threats with each other, in the form of indicators, to a community of trust for threat analysis and incident response. However, sharing threat-related information have posed various risks to an organization that pertains to its security, privacy, and competitiveness. Given the coinciding benefits and risks of threat information sharing, some entities have adopted an elusive behavior of ""free-riding"" so that they can acquire the benefits of sharing without contributing much to the community. So far, understanding the effectiveness of sharing has been viewed from the perspective of the amount of information exchanged as opposed to its quality. In this paper, we introduce the notion of quality of indicators (\qoi) for the assessment of the level of contribution by participants in information sharing for threat intelligence. We exemplify this notion through various metrics, including correctness, relevance, utility, and uniqueness of indicators. In order to realize the notion of \qoi, we conducted an empirical study and taken a benchmark approach to define quality metrics, then we obtained a reference dataset and utilized tools from the machine learning literature for quality assessment. We compared these results against a model that only considers the volume of information as a metric for contribution, and unveiled various interesting observations, including the ability to spot low quality contributions that are synonym to free riding in threat information sharing. "
On the Design of LQR Kernels for Efficient Controller Learning,"  Finding optimal feedback controllers for nonlinear dynamic systems from data is hard. Recently, Bayesian optimization (BO) has been proposed as a powerful framework for direct controller tuning from experimental trials. For selecting the next query point and finding the global optimum, BO relies on a probabilistic description of the latent objective function, typically a Gaussian process (GP). As is shown herein, GPs with a common kernel choice can, however, lead to poor learning outcomes on standard quadratic control problems. For a first-order system, we construct two kernels that specifically leverage the structure of the well-known Linear Quadratic Regulator (LQR), yet retain the flexibility of Bayesian nonparametric learning. Simulations of uncertain linear and nonlinear systems demonstrate that the LQR kernels yield superior learning performance. "
How does propaganda influence the opinion dynamics of a population ?,"  The evolution of opinions in a population of individuals who constantly interact with a common source of user-generated content (i.e. the internet) and are also subject to propaganda is analyzed using computer simulations. The model is based on the bounded confidence approach. In the absence of propaganda, computer simulations show that the online population as a whole is either fragmented, polarized or in perfect harmony on a certain issue or ideology depending on the uncertainty of individuals in accepting opinions not closer to theirs. On applying the model to simulate radicalization, a proportion of the online population, subject to extremist propaganda radicalize depending on their pre-conceived opinions and opinion uncertainty. It is found that an optimal counter propaganda that prevents radicalization is not necessarily centrist. "
Explicit Solution for Constrained Stochastic Linear-Quadratic Control with Multiplicative Noise,"  We study in this paper a class of constrained linear-quadratic (LQ) optimal control problem formulations for the scalar-state stochastic system with multiplicative noise, which has various applications, especially in the financial risk management. The linear constraint on both the control and state variables considered in our model destroys the elegant structure of the conventional LQ formulation and has blocked the derivation of an explicit control policy so far in the literature. We successfully derive in this paper the analytical control policy for such a class of problems by utilizing the state separation property induced from its structure. We reveal that the optimal control policy is a piece-wise affine function of the state and can be computed off-line efficiently by solving two coupled Riccati equations. Under some mild conditions, we also obtain the stationary control policy for infinite time horizon. We demonstrate the implementation of our method via some illustrative examples and show how to calibrate our model to solve dynamic constrained portfolio optimization problems. "
Viewpoint Selection for Photographing Architectures,"This paper studies the problem of how to choose good viewpoints for taking photographs of architectures. We achieve this by learning from professional photographs of world famous landmarks that are available on the Internet. Unlike previous efforts devoted to photo quality assessment which mainly rely on 2D image features, we show in this paper combining 2D image features extracted from images with 3D geometric features computed on the 3D models can result in more reliable evaluation of viewpoint quality. Specifically, we collect a set of photographs for each of 15 world famous architectures as well as their 3D models from the Internet. Viewpoint recovery for images is carried out through an image-model registration process, after which a newly proposed viewpoint clustering strategy is exploited to validate users' viewpoint preferences when photographing landmarks. Finally, we extract a number of 2D and 3D features for each image based on multiple visual and geometric cues and perform viewpoint recommendation by learning from both 2D and 3D features using a specifically designed SVM-2K multi-view learner, achieving superior performance over using solely 2D or 3D features. We show the effectiveness of the proposed approach through extensive experiments. The experiments also demonstrate that our system can be used to recommend viewpoints for rendering textured 3D models of buildings for the use of architectural design, in addition to viewpoint evaluation of photographs and recommendation of viewpoints for photographing architectures in practice."
Geophysical tests for habitability in ice-covered ocean worlds,"Geophysical measurements can reveal the structure of icy ocean worlds and cycling of volatiles. The associated density, temperature, sound speed, and electrical conductivity of such worlds thus characterizes their habitability. To explore the variability and correlation of these parameters, and to provide tools for planning and data analyses, we develop 1-D calculations of internal structure, which use available constraints on the thermodynamics of aqueous MgSO$_4$, NaCl (as seawater), and NH$_3$, water ices, and silicate content. Limits in available thermodynamic data narrow the parameter space that can be explored: insufficient coverage in pressure, temperature, and composition for end-member salinities of MgSO$_4$ and NaCl, and for relevant water ices; and a dearth of suitable data for aqueous mixtures of Na-Mg-Cl-SO$_4$-NH$_3$. For Europa, ocean compositions that are oxidized and dominated by MgSO$_4$, vs reduced (NaCl), illustrate these gaps, but also show the potential for diagnostic and measurable combinations of geophysical parameters. The low-density rocky core of Enceladus may comprise hydrated minerals, or anydrous minerals with high porosity comparable to Earth's upper mantle. Titan's ocean must be dense, but not necessarily saline, as previously noted, and may have little or no high-pressure ice at its base. Ganymede's silicious interior is deepest among all known ocean worlds, and may contain multiple phases of high-pressure ice, which will become buoyant if the ocean is sufficiently salty. Callisto's likely near-eutectic ocean cannot be adequately modeled using available data. Callisto may also lack high-pressure ices, but this cannot be confirmed due to uncertainty in its moment of inertia."
A fast speed planning algorithm for robotic manipulators,"  We consider the speed planning problem for a robotic manipulator. In particular, we present an algorithm for finding the time-optimal speed law along an assigned path that satisfies velocity and acceleration constraints and respects the maximum forces and torques allowed by the actuators. The addressed optimization problem is a finite dimensional reformulation of the continuous-time speed optimization problem, obtained by discretizing the speed profile with N points. The proposed algorithm has linear complexity with respect to N and to the number of degrees of freedom. Such complexity is the best possible for this problem. Numerical tests show that the proposed algorithm is significantly faster than algorithms already existing in literature. "
Linearly convergent stochastic heavy ball method for minimizing generalization error,"  In this work we establish the first linear convergence result for the stochastic heavy ball method. The method performs SGD steps with a fixed stepsize, amended by a heavy ball momentum term. In the analysis, we focus on minimizing the expected loss and not on finite-sum minimization, which is typically a much harder problem. While in the analysis we constrain ourselves to quadratic loss, the overall objective is not necessarily strongly convex. "
Applying the Spacecraft with a Solar Sail to Form the Climate on a Mars Base,"  This article is devoted to research the application of the spacecraft with a solar sail to support the certain climatic conditions in an area of the Mars surface. Authors propose principles of functioning of the spacecraft, intended to create a light and thermal light spot in a predetermined area of the Martian surface. The mathematical motion model in such condition of the solar sail's orientation is considered and used for motion simulation session. Moreover, the analysis of this motion is performed. Thus, were obtained parameters of the stationary orbit of the spacecraft with a solar sail and were given recommendations for further applying spacecrafts to reflect the sunlight on a planet's surface. "
Data processing pipeline for Herschel HIFI,"{Context}. The HIFI instrument on the Herschel Space Observatory performed over 9100 astronomical observations, almost 900 of which were calibration observations in the course of the nearly four-year Herschel mission. The data from each observation had to be converted from raw telemetry into calibrated products and were included in the Herschel Science Archive. {Aims}. The HIFI pipeline was designed to provide robust conversion from raw telemetry into calibrated data throughout all phases of the HIFI missions. Pre-launch laboratory testing was supported as were routine mission operations. {Methods}. A modular software design allowed components to be easily added, removed, amended and/or extended as the understanding of the HIFI data developed during and after mission operations. {Results}. The HIFI pipeline processed data from all HIFI observing modes within the Herschel automated processing environment as well as within an interactive environment. The same software can be used by the general astronomical community to reprocess any standard HIFI observation. The pipeline also recorded the consistency of processing results and provided automated quality reports. Many pipeline modules were in use since the HIFI pre-launch instrument level testing. {Conclusions}. Processing in steps facilitated data analysis to discover and address instrument artefacts and uncertainties. The availability of the same pipeline components from pre-launch throughout the mission made for well-understood, tested, and stable processing. A smooth transition from one phase to the next significantly enhanced processing reliability and robustness."
