Community Detection on Euclidean Random Graphs,"  We study the problem of community detection (CD) on Euclidean random geometric graphs where each vertex has two latent variables: a binary community label and a $\mathbb{R}^d$ valued location label which forms the support of a Poisson point process of intensity $\lambda$. A random graph is then drawn with edge probabilities dependent on both the community and location labels. In contrast to the stochastic block model (SBM) that has no location labels, the resulting random graph contains many more short loops due to the geometric embedding. We consider the recovery of the community labels, partial and exact, using the random graph and the location labels. We establish phase transitions for both sparse and logarithmic degree regimes, and provide bounds on the location of the thresholds, conjectured to be tight in the case of exact recovery. We also show that the threshold of the distinguishability problem, i.e., the testing between our model and the null model without community labels exhibits no phase-transition and in particular, does not match the weak recovery threshold (in contrast to the SBM). "
Load balancing with heterogeneous schedulers,"Load balancing is a common approach in web server farms or inventory routing problems. An important issue in such systems is to determine the server to which an incoming request should be routed to optimize a given performance criteria. In this paper, we assume the server's scheduling disciplines to be heterogeneous. More precisely, a server implements a scheduling discipline which belongs to the class of limited processor sharing (LPS-$d$) scheduling disciplines. Under LPS-$d$, up to $d$ jobs can be served simultaneously, and hence, includes as special cases First Come First Served ($d=1$) and Processor Sharing ($d=\infty$). In order to obtain efficient heuristics, we model the above load-balancing framework as a multi-armed restless bandit problem. Using the relaxation technique, as first developed in the seminal work of Whittle, we derive Whittle's index policy for general cost functions and obtain a closed-form expression for Whittle's index in terms of the steady-state distribution. Through numerical computations, we investigate the performance of Whittle's index with two different performance criteria: linear cost criterion and a cost criterion that depends on the first and second moment of the throughput. Our results show that \emph{(i)} the structure of Whittle's index policy can strongly depend on the scheduling discipline implemented in the server, i.e., on $d$, and that \emph{(ii)} Whittle's index policy significantly outperforms standard dispatching rules such as Join the Shortest Queue (JSQ), Join the Shortest Expected Workload (JSEW), and Random Server allocation (RSA)."
An Information Theoretic Framework for Active De-anonymization in Social Networks Based on Group Memberships,"  In this paper, a new mathematical formulation for the problem of de-anonymizing social network users by actively querying their membership in social network groups is introduced. In this formulation, the attacker has access to a noisy observation of the group membership of each user in the social network. When an unidentified victim visits a malicious website, the attacker uses browser history sniffing to make queries regarding the victim's social media activity. Particularly, it can make polar queries regarding the victim's group memberships and the victim's identity. The attacker receives noisy responses to her queries. The goal is to de-anonymize the victim with the minimum number of queries. Starting with a rigorous mathematical model for this active de-anonymization problem, an upper bound on the attacker's expected query cost is derived, and new attack algorithms are proposed which achieve this bound. These algorithms vary in computational cost and performance. The results suggest that prior heuristic approaches to this problem provide sub-optimal solutions. "
Geobiodynamics and Roegenian Economic Systems,"  This mathematical essay brings together ideas from Economics, Geobiodynamics and Thermodynamics. Its purpose is to obtain real models of complex evolutionary systems. More specifically, the essay defines Roegenian Economy and links Geobiodynamics and Roegenian Economy. In this context, we discuss the isomorphism between the concepts and techniques of Thermodynamics and Economics. Then we describe a Roegenian economic system like a Carnot group. After we analyse the phase equilibrium for two heterogeneous economic systems. The European Union Economics appears like Cartesian product of Roegenian economic systems and its Balance is analysed in details. A Section at the end describes the ""economic black holes"" as small parts of a a global economic system in which national income is so great that it causes others poor enrichment. These ideas can be used to improve our knowledge and understanding of the nature of development and evolution of thermodynamic-economic systems. "
The effects of the overshooting of the convective core on main-sequence turnoffs of young- and intermediate-age star clusters,"Recent investigations have shown that the extended main-sequence turnoffs (eMSTOs) are a common feature of intermediate-age star clusters in the Magellanic Clouds. The eMSTOs are also found in the color-magnitude diagram (CMD) of young-age star clusters. The origin of the eMSTOs is still an open question. Moreover, asteroseismology shows that the value of the overshooting parameter $\delta_{\rm ov}$ of the convective core is not fixed for the stars with an approximatelly equal mass. Thus the MSTO of star clusters may be affected by the overshooting of the convective core (OVCC). We calculated the effects of the OVCC with different $\delta_{\rm ov}$ on the MSTO of young- and intermediate-age star clusters. \textbf{If $\delta_{\rm ov}$ varies between stars in a cluster,} the observed eMSTOs of young- and intermediate-age star clusters can be explained well by the effects. The equivalent age spreads of MSTO caused by the OVCC are related to the age of star clusters and are in good agreement with observed results of many clusters. Moreover, the observed eMSTOs of NGC 1856 are reproduced by the coeval populations with different $\delta_{\rm ov}$. The eMSTOs of star clusters may be relevant to the effects of the OVCC. The effects of the OVCC \textbf{are similar to that of rotation in some respects. But the effects cannot result in a significant split of main sequence of young star clusters at $m_{U}\lesssim 21$.} The presence of a rapid rotation can make the split of main sequence of young star clusters more significant."
First eigenvalue estimates of Dirichlet-to-Neumann operators on graphs,"Following Escobar [Esc97] and Jammes [Jam15], we introduce two types of isoperimetric constants and give lower bound estimates for the first nontrivial eigenvalues of Dirichlet-to-Neumann operators on finite graphs with boundary respectively."
Air-burst Generated Tsunamis,"  This paper examines the questions of whether smaller asteroids that burst in the air over water can generate tsunamis that could pose a threat to distant locations. Such air burst-generated tsunamis are qualitatively different than the more frequently studied earthquake-generated tsunamis, and differ as well from impact asteroids. Numerical simulations are presented using the shallow water equations in several settings, demonstrating very little tsunami threat from this scenario. A model problem with an explicit solution that demonstrates and explains the same phenomena found in the computations is analyzed. We discuss the question of whether compressibility and dispersion are important effects that should be included, and show results from a more sophisticated model problem using the linearized Euler equations that begins to addresses this. "
A new design principle of robust onion-like networks self-organized in growth,"  Today's economy, production activity, and our life are sustained by social and technological network infrastructures, while new threats of network attacks by destructing loops have been found recently in network science. We inversely take into account the weakness, and propose a new design principle for incrementally growing robust networks. The networks are self-organized by enhancing interwoven long loops. In particular, we consider the range-limited approximation of linking by intermediations in a few hops, and show the strong robustness in the growth without degrading efficiency of paths. Moreover, we demonstrate that the tolerance of connectivity is reformable even from extremely vulnerable real networks according to our proposed growing process with some investment. These results may indicate a prospective direction to the future growth of our network infrastructures. "
Surrogate Losses for Online Learning of Stepsizes in Stochastic Non-Convex Optimization,"  Stochastic Gradient Descent (SGD) has played a central role in machine learning. However, it requires a carefully hand-picked stepsize for fast convergence, which is notoriously tedious and time-consuming to tune. Over the last several years, a plethora of adaptive gradient-based algorithms have emerged to ameliorate this problem. They have proved efficient in reducing the labor of tuning in practice, but many of them lack theoretic guarantees even in the convex setting. In this paper, we propose new surrogate losses to cast the problem of learning the optimal stepsizes for the stochastic optimization of a non-convex smooth objective function onto an online convex optimization problem. This allows the use of no-regret online algorithms to compute optimal stepsizes on the fly. In turn, this results in a SGD algorithm with self-tuned stepsizes that guarantees convergence rates that are automatically adaptive to the level of noise. "
On Categorical Time Series Models With Covariates,"  We study the problem of stationarity and ergodicity for autoregressive multinomial logistic time series models which possibly include a latent process and are defined by a GARCH-type recursive equation. We improve considerably upon the existing results related to stationarity and ergodicity conditions of such models. Proofs are based on theory developed for chains with complete connections. This approach is based on a useful coupling technique which is utilized for studying ergodicity of more general finite-state stochastic processes. Such processes generalize finite-state Markov chains by assuming infinite order models of past values. For finite order Markov chains, we also discuss ergodicity properties when some strongly exogenous covariates are considered in the dynamics of the process. "
Layered Coding for Energy Harvesting Communication Without CSIT,"  Due to stringent constraints on resources, it may be infeasible to acquire the current channel state information at the transmitter in energy harvesting communication systems. In this paper, we optimize an energy harvesting transmitter, communicating over a slow fading channel, using layered coding. The transmitter has access to the channel statistics, but does not know the exact channel state. In layered coding, the codewords are first designed for each of the channel states at different rates, and then the codewords are either time-multiplexed or superimposed before the transmission, leading to two transmission strategies. The receiver then decodes the information adaptively based on the realized channel state. The transmitter is equipped with a finite-capacity battery having non-zero internal resistance. In each of the transmission strategies, we first formulate and study an average rate maximization problem with non-causal knowledge of the harvested power variations. Further, assuming statistical knowledge and causal information of the harvested power variations, we propose a sub-optimal algorithm, and compare with the stochastic dynamic programming based solution and a greedy policy. "
The automorphisms of Petit's algebras,"Let $\sigma$ be an automorphism of a field $K$ with fixed field $F$. We study the automorphisms of nonassociative unital algebras which are canonical generalizations of the associative quotient algebras $K[t;\sigma]/fK[t;\sigma]$ obtained when the twisted polynomial $f\in K[t;\sigma]$ is invariant, and were first defined by Petit. We compute all their automorphisms if $\sigma$ commutes with all automorphisms in ${\rm Aut}_F(K)$ and $n\geq m-1$, where $n$ is the order of $\sigma$ and $m$ the degree of $f$,and obtain partial results for $n<m-1$. In the case where $K/F$ is a finite Galois field extension, we obtain more detailed information on the structure of the automorphism groups of these nonassociative unital algebras over $F$. We also briefly investigate when two such algebras are isomorphic."
A convolutional autoencoder approach for mining features in cellular electron cryo-tomograms and weakly supervised coarse segmentation,"Cellular electron cryo-tomography enables the 3D visualization of cellular organization in the near-native state and at submolecular resolution. However, the contents of cellular tomograms are often complex, making it difficult to automatically isolate different in situ cellular components. In this paper, we propose a convolutional autoencoder-based unsupervised approach to provide a coarse grouping of 3D small subvolumes extracted from tomograms. We demonstrate that the autoencoder can be used for efficient and coarse characterization of features of macromolecular complexes and surfaces, such as membranes. In addition, the autoencoder can be used to detect non-cellular features related to sample preparation and data collection, such as carbon edges from the grid and tomogram boundaries. The autoencoder is also able to detect patterns that may indicate spatial interactions between cellular components. Furthermore, we demonstrate that our autoencoder can be used for weakly supervised semantic segmentation of cellular components, requiring a very small amount of manual annotation."
Probabilistic Rule Realization and Selection,"  Abstraction and realization are bilateral processes that are key in deriving intelligence and creativity. In many domains, the two processes are approached through rules: high-level principles that reveal invariances within similar yet diverse examples. Under a probabilistic setting for discrete input spaces, we focus on the rule realization problem which generates input sample distributions that follow the given rules. More ambitiously, we go beyond a mechanical realization that takes whatever is given, but instead ask for proactively selecting reasonable rules to realize. This goal is demanding in practice, since the initial rule set may not always be consistent and thus intelligent compromises are needed. We formulate both rule realization and selection as two strongly connected components within a single and symmetric bi-convex problem, and derive an efficient algorithm that works at large scale. Taking music compositional rules as the main example throughout the paper, we demonstrate our model's efficiency in not only music realization (composition) but also music interpretation and understanding (analysis). "
Asymptotic and numerical analysis of a porous medium model for transpiration-driven sap flow in trees,"We develop a 3D porous medium model for sap flow within a tree stem, which consists of a nonlinear parabolic partial differential equation with a suitable transpiration source term. Using an asymptotic analysis, we derive approximate series solutions for the liquid saturation and sap velocity for a general class of coefficient functions. Several important non-dimensional parameters are identified that can be used to characterize various flow regimes. We investigate the relative importance of stem aspect ratio versus anisotropy in the sapwood hydraulic conductivity, and how these two effects impact the radial and vertical components of sap velocity. The analytical results are validated by means of a second-order finite volume discretization of the governing equations, and comparisons are drawn to experimental results on Norway spruce trees."
Risk Estimators for Choosing Regularization Parameters in Ill-Posed Problems - Properties and Limitations,"  This paper discusses the properties of certain risk estimators recently proposed to choose regularization parameters in ill-posed problems. A simple approach is Stein's unbiased risk estimator (SURE), which estimates the risk in the data space, while a recent modification (GSURE) estimates the risk in the space of the unknown variable. It seems intuitive that the latter is more appropriate for ill-posed problems, since the properties in the data space do not tell much about the quality of the reconstruction. We provide theoretical studies of both estimators for linear Tikhonov regularization in a finite dimensional setting and estimate the quality of the risk estimators, which also leads to asymptotic convergence results as the dimension of the problem tends to infinity. Unlike previous papers, who studied image processing problems with a very low degree of ill-posedness, we are interested in the behavior of the risk estimators for increasing ill-posedness. Interestingly, our theoretical results indicate that the quality of the GSURE risk can deteriorate asymptotically for ill-posed problems, which is confirmed by a detailed numerical study. The latter shows that in many cases the GSURE estimator leads to extremely small regularization parameters, which obviously cannot stabilize the reconstruction. Similar but less severe issues with respect to robustness also appear for the SURE estimator, which in comparison to the rather conservative discrepancy principle leads to the conclusion that regularization parameter choice based on unbiased risk estimation is not a reliable procedure for ill-posed problems. A similar numerical study for sparsity regularization demonstrates that the same issue appears in nonlinear variational regularization approaches. "
Analyzing Effects of Seasonal Variations in Wind Generation and Load on Voltage Profiles,"This paper presents a methodology for building daily profiles of wind generation and load for different seasons to assess their impacts on voltage violations. The measurement-based wind models showed very high accuracy when validated against several years of actual wind power data. System load modeling was carried out by analyzing the seasonal trends that occur in residential, commercial, and industrial loads. When the proposed approach was implemented on the IEEE 118-bus system, it could identify violations in bus voltage profiles that the season-independent model could not capture. The results of the proposed approach are expected to provide better visualization of the problems that seasonal variations in wind power and load might cause to the electric power grid."
Imitation Learning from Imperfect Demonstration,"Imitation learning (IL) aims to learn an optimal policy from demonstrations. However, such demonstrations are often imperfect since collecting optimal ones is costly. To effectively learn from imperfect demonstrations, we propose a novel approach that utilizes confidence scores, which describe the quality of demonstrations. More specifically, we propose two confidence-based IL methods, namely two-step importance weighting IL (2IWIL) and generative adversarial IL with imperfect demonstration and confidence (IC-GAIL). We show that confidence scores given only to a small portion of sub-optimal demonstrations significantly improve the performance of IL both theoretically and empirically."
Some Bounds on Binary LCD Codes,"A linear code with a complementary dual (or LCD code) is defined to be a linear code $C$ whose dual code $C^{\perp}$ satisfies $C \cap C^{\perp}$= $\left\{ \mathbf{0}\right\} $. Let $LCD{[}n,k{]}$ denote the maximum of possible values of $d$ among $[n,k,d]$ binary LCD codes. We give exact values of $LCD{[}n,k{]}$ for $1 \le k \le n \le 12$. We also show that $LCD[n,n-i]=2$ for any $i\geq2$ and $n\geq2^{i}$. Furthermore, we show that $LCD[n,k]\leq LCD[n,k-1]$ for $k$ odd and $LCD[n,k]\leq LCD[n,k-2]$ for $k$ even."
Control-Oriented Learning on the Fly,"  This paper focuses on developing a strategy for control of systems whose dynamics are almost entirely unknown. This situation arises naturally in a scenario where a system undergoes a critical failure. In that case, it is imperative to retain the ability to satisfy basic control objectives in order to avert an imminent catastrophe. A prime example of such an objective is the reach-avoid problem, where a system needs to move to a certain state in a constrained state space. To deal with limitations on our knowledge of system dynamics, we develop a theory of myopic control. The primary goal of myopic control is to, at any given time, optimize the current direction of the system trajectory, given solely the information obtained about the system until that time. We propose an algorithm that uses small perturbations in the control effort to learn local dynamics while simultaneously ensuring that the system moves in a direction that appears to be nearly optimal, and provide hard bounds for its suboptimality. We additionally verify the usefulness of the algorithm on a simulation of a damaged aircraft seeking to avoid a crash, as well as on an example of a Van der Pol oscillator. "
Multi Agent Driven Data Mining For Knowledge Discovery in Cloud Computing,"  Today, huge amount of data is available on the web. Now there is a need to convert that data in knowledge which can be useful for different purposes. This paper depicts the use of data mining process, OLAP with the combination of multi agent system to find the knowledge from data in cloud computing. For this, I am also trying to explain one case study of online shopping of one Bakery Shop. May be we can increase the sale of items by using the model, which I am trying to represent. "
Matrix Completion from $O(n)$ Samples in Linear Time,"We consider the problem of reconstructing a rank-$k$ $n \times n$ matrix $M$ from a sampling of its entries. Under a certain incoherence assumption on $M$ and for the case when both the rank and the condition number of $M$ are bounded, it was shown in \cite{CandesRecht2009, CandesTao2010, keshavan2010, Recht2011, Jain2012, Hardt2014} that $M$ can be recovered exactly or approximately (depending on some trade-off between accuracy and computational complexity) using $O(n \, \text{poly}(\log n))$ samples in super-linear time $O(n^{a} \, \text{poly}(\log n))$ for some constant $a \geq 1$. In this paper, we propose a new matrix completion algorithm using a novel sampling scheme based on a union of independent sparse random regular bipartite graphs. We show that under the same conditions w.h.p. our algorithm recovers an $\epsilon$-approximation of $M$ in terms of the Frobenius norm using $O(n \log^2(1/\epsilon))$ samples and in linear time $O(n \log^2(1/\epsilon))$. This provides the best known bounds both on the sample complexity and computational complexity for reconstructing (approximately) an unknown low-rank matrix. The novelty of our algorithm is two new steps of thresholding singular values and rescaling singular vectors in the application of the ""vanilla"" alternating minimization algorithm. The structure of sparse random regular graphs is used heavily for controlling the impact of these regularization steps."
"Ingestion, Indexing and Retrieval of High-Velocity Multidimensional Sensor Data on a Single Node","  Multidimensional data are becoming more prevalent, partly due to the rise of the Internet of Things (IoT), and with that the need to ingest and analyze data streams at rates higher than before. Some industrial IoT applications require ingesting millions of records per second, while processing queries on recently ingested and historical data. Unfortunately, existing database systems suited to multidimensional data exhibit low per-node ingestion performance, and even if they can scale horizontally in distributed settings, they require large number of nodes to meet such ingest demands. For this reason, in this paper we evaluate a single-node multidimensional data store for high-velocity sensor data. Its design centers around a two-level indexing structure, wherein the global index is an in-memory R*-tree and the local indices are serialized kd-trees. This study is confined to records with numerical indexing fields and range queries, and covers ingest throughput, query response time, and storage footprint. We show that the adopted design streamlines data ingestion and offers ingress rates two orders of magnitude higher than those of Percona Server, SQLite, and Druid. Our prototype also reports query response times comparable to or better than those of Percona Server and Druid, and compares favorably in terms of storage footprint. In addition, we evaluate a kd-tree partitioning based scheme for grouping incoming streamed data records. Compared to a random scheme, this scheme produces less overlap between groups of streamed records, but contrary to what we expected, such reduced overlap does not translate into better query performance. By contrast, the local indices prove much more beneficial to query performance. We believe the experience reported in this paper is valuable to practitioners and researchers alike interested in building database systems for high-velocity multidimensional data. "
