Regret Analysis for Continuous Dueling Bandit,"  The dueling bandit is a learning framework wherein the feedback information in the learning process is restricted to a noisy comparison between a pair of actions. In this research, we address a dueling bandit problem based on a cost function over a continuous space. We propose a stochastic mirror descent algorithm and show that the algorithm achieves an $O(\sqrt{T\log T})$-regret bound under strong convexity and smoothness assumptions for the cost function. Subsequently, we clarify the equivalence between regret minimization in dueling bandit and convex optimization for the cost function. Moreover, when considering a lower bound in convex optimization, our algorithm is shown to achieve the optimal convergence rate in convex optimization and the optimal regret in dueling bandit except for a logarithmic factor. "
X-ray induced deuterium enrichment on N-rich organics in protoplanetary disks: an experimental investigation using synchrotron light,"The deuterium enrichment of organics in the interstellar medium, protoplanetary disks and meteorites has been proposed to be the result of ionizing radiation. The goal of this study is to quantify the effects of soft X-rays (0.1 - 2 keV), a component of stellar radiation fields illuminating protoplanetary disks, on the refractory organics present in the disks. We prepared tholins, nitrogen-rich complex organics, via plasma deposition and used synchrotron radiation to simulate X-ray fluences in protoplanetary disks. Controlled irradiation experiments at 0.5 and 1.3 keV were performed at the SEXTANTS beam line of the SOLEIL synchrotron, and were followed by ex-situ infrared, Raman and isotopic diagnostics. Infrared spectroscopy revealed the loss of singly-bonded groups (N-H, C-H and R-N$\equiv$C) and the formation of sp$^3$ carbon defects. Raman analysis revealed the introduction of defects and structural amorphization. Finally, tholins were measured via secondary ion mass spectrometry (SIMS), revealing that significant D-enrichment is induced by X-ray irradiation. Our results are compared to previous experimental studies involving the thermal degradation and electron irradiation of organics. The penetration depth of soft X-rays in $\mu$m-sized tholins leads to volume rather than surface modifications: lower energy X-rays (0.5 keV) induce a larger D-enrichment than 1.3 keV X-rays, reaching a plateau for doses larger than 5 $\times$ 10$^{27}$ eV cm$^{-3}$. Our work provides experimental evidence of a new non-thermal pathway to deuterium fractionation of organic matter."
Parisian ruin of Brownian motion risk model over an infinite-time horizon,"Let $B(t), t\in \mathbb{R}$ be a standard Brownian motion. In this paper, we derive the exact asymptotics of the probability of Parisian ruin on infinite time horizon for the following risk process \begin{align}\label{Rudef} R_u^{\delta}(t)=e^{\delta t}\left(u+c\int^{t}_{0}e^{-\delta v}d v-\sigma\int_{0}^{t}e^{-\delta v}d B(v)\right),\quad t\geq0, \end{align} where $u\geq 0$ is the initial reserve, $\delta\geq0$ is the force of interest, $c>0$ is the rate of premium and $\sigma>0$ is a volatility factor. Further, we show the asymptotics of the Parisian ruin time of this risk process."
"Exogeneity tests, incomplete models, weak identification and non-Gaussian distributions: invariance and finite-sample distributional theory","We study the distribution of Durbin-Wu-Hausman (DWH) and Revankar-Hartley (RH) tests for exogeneity from a finite-sample viewpoint, under the null and alternative hypotheses. We consider linear structural models with possibly non-Gaussian errors, where structural parameters may not be identified and where reduced forms can be incompletely specified (or nonparametric). On level control, we characterize the null distributions of all the test statistics. Through conditioning and invariance arguments, we show that these distributions do not involve nuisance parameters. In particular, this applies to several test statistics for which no finite-sample distributional theory is yet available, such as the standard statistic proposed by Hausman (1978). The distributions of the test statistics may be non-standard -- so corrections to usual asymptotic critical values are needed -- but the characterizations are sufficiently explicit to yield finite-sample (Monte-Carlo) tests of the exogeneity hypothesis. The procedures so obtained are robust to weak identification, missing instruments or misspecified reduced forms, and can easily be adapted to allow for parametric non-Gaussian error distributions. We give a general invariance result (block triangular invariance) for exogeneity test statistics. This property yields a convenient exogeneity canonical form and a parsimonious reduction of the parameters on which power depends. In the extreme case where no structural parameter is identified, the distributions under the alternative hypothesis and the null hypothesis are identical, so the power function is flat, for all the exogeneity statistics. However, as soon as identification does not fail completely, this phenomenon typically disappears."
Pair formation of hard core bosons in flat band systems,"  Hard core bosons in a large class of one or two dimensional flat band systems have an upper critical density, below which the ground states can be described completely. At the critical density, the ground states are Wigner crystals. If one adds a particle to the system at the critical density, the ground state and the low lying multi particle states of the system can be described as a Wigner crystal with an additional pair of particles. The energy band for the pair is separated from the rest of the multi-particle spectrum. The proofs use a Gerschgorin type of argument for block diagonally dominant matrices. In certain one-dimensional or tree-like structures one can show that the pair is localised, for example in the chequerboard chain. For this one-dimensional system with periodic boundary condition the energy band for the pair is flat, the pair is localised. "
"A Note on the Relationship Between Conditional and Unconditional Independence, and its Extensions for Markov Kernels","  Two known results on the relationship between conditional and unconditional independence are obtained as a consequence of the main result of this paper, a theorem that uses independence of Markov kernels to obtain a minimal condition which added to conditional independence implies independence. Some counterexamples and representation results are provided to clarify the concepts introduced and the propositions of the statement of the main theorem. Moreover, conditional independence and the mentioned results are extended to the framework of Markov kernels. "
The Effect of Temperature on Amdahl Law in 3D Multicore Era,"This work studies the influence of temperature on performance and scalability of 3D Chip Multiprocessors (CMP) from Amdahl law perspective. We find that 3D CMP may reach its thermal limit before reaching its maximum power. We show that a high level of parallelism may lead to high peak temperatures even in small scale 3D CMPs, thus limiting 3D CMP scalability and calling for different, in-memory computing architectures."
Video Object Segmentation using Supervoxel-Based Gerrymandering,"  Pixels operate locally. Superpixels have some potential to collect information across many pixels; supervoxels have more potential by implicitly operating across time. In this paper, we explore this well established notion thoroughly analyzing how supervoxels can be used in place of and in conjunction with other means of aggregating information across space-time. Focusing on the problem of strictly unsupervised video object segmentation, we devise a method called supervoxel gerrymandering that links masks of foregroundness and backgroundness via local and non-local consensus measures. We pose and answer a series of critical questions about the ability of supervoxels to adequately sway local voting; the questions regard type and scale of supervoxels as well as local versus non-local consensus, and the questions are posed in a general way so as to impact the broader knowledge of the use of supervoxels in video understanding. We work with the DAVIS dataset and find that our analysis yields an unsupervised method that outperforms all other known unsupervised methods and even many supervised ones. "
The Absent-Minded Driver Problem Redux,"  This paper reconsiders the problem of the absent-minded driver who must choose between alternatives with different payoff with imperfect recall and varying degrees of knowledge of the system. The classical absent-minded driver problem represents the case with limited information and it has bearing on the general area of communication and learning, social choice, mechanism design, auctions, theories of knowledge, belief, and rational agency. Within the framework of extensive games, this problem has applications to many artificial intelligence scenarios. It is obvious that the performance of the agent improves as information available increases. It is shown that a non-uniform assignment strategy for successive choices does better than a fixed probability strategy. We consider both classical and quantum approaches to the problem. We argue that the superior performance of quantum decisions with access to entanglement cannot be fairly compared to a classical algorithm. If the cognitive systems of agents are taken to have access to quantum resources, or have a quantum mechanical basis, then that can be leveraged into superior performance. "
Real-time Acceleration-continuous Path-constrained Trajectory Planning With Built-in Tradability Between Cruise and Time-optimal Motions,"  In this paper, a novel real-time acceleration-continuous path-constrained trajectory planning algorithm is proposed with an appealing built-in tradability mechanism between cruise motion and time-optimal motion. Different from existing approaches, the proposed approach smoothens time-optimal trajectories with bang-bang input structures to generate acceleration-continuous trajectories while preserving the completeness property. More importantly, a novel built-in tradability mechanism is proposed and embedded into the trajectory planning framework, so that the proportion of the cruise motion and time-optimal motion can be flexibly adjusted by changing a user-specified functional parameter. Thus, the user can easily apply the trajectory planning algorithm for various tasks with different requirements on motion efficiency and cruise proportion. Moreover, it is shown that feasible trajectories are computed more quickly than optimal trajectories. Rigorous mathematical analysis and proofs are provided for these aforementioned results. Comparative simulation and experimental results on omnidirectional wheeled mobile robots demonstrate the capability of the proposed algorithm in terms of flexible tunning between cruise and time-optimal motions, as well as higher computational efficiency. "
Multi-locus data distinguishes between population growth and multiple merger coalescents,"  We introduce a low dimensional function of the site frequency spectrum that is tailor-made for distinguishing coalescent models with multiple mergers from Kingman coalescent models with population growth, and use this function to construct a hypothesis test between these model classes. The null and alternative sampling distributions of the statistic are intractable, but its low dimensionality renders them amenable to Monte Carlo estimation. We construct kernel density estimates of the sampling distributions based on simulated data, and show that the resulting hypothesis test dramatically improves on the statistical power of a current state-of-the-art method. A key reason for this improvement is the use of multi-locus data, in particular averaging observed site frequency spectra across unlinked loci to reduce sampling variance. We also demonstrate the robustness of our method to nuisance and tuning parameters. Finally we show that the same kernel density estimates can be used to conduct parameter estimation, and argue that our method is readily generalisable for applications in model selection, parameter inference and experimental design. "
Ramsey interferometry of Rydberg ensembles inside microwave cavities,"We study ensembles of Rydberg atoms in a confined electromagnetic environment such as provided by a microwave cavity. The competition between standard free space Ising type and cavity-mediated interactions leads to the emergence of different regimes where the particle-particle couplings range from the typical van der Waals $r^{-6}$ behavior to $r^{-3}$ and to $r$-independence. We apply a Ramsey spectroscopic technique to map the two-body interactions into a characteristic signal such as intensity and contrast decay curves. As opposed to previous treatments requiring high-densities for considerable contrast and phase decay, the cavity scenario can exhibit similar behavior at much lower densities."
Impurity self-energy in the strongly-correlated Bose systems,We proposed the non-perturbative scheme for calculation of the impurity spectrum in the Bose system at zero temperature. The method is based on the path-integral formulation and describes an impurity as a zero-density ideal Fermi gas interacting with Bose system for which the action is written in terms of density fluctuations. On the example of the $^3$He atom immersed in the liquid helium-4 a good consistency with experimental data and results of Monte Carlo simulations is shown.
$k$-step correction for mixed integer linear programming: a new approach for instrumental variable quantile regressions and related problems,"This paper proposes a new framework for estimating instrumental variable (IV) quantile models. The first part of our proposal can be cast as a mixed integer linear program (MILP), which allows us to capitalize on recent progress in mixed integer optimization. The computational advantage of the proposed method makes it an attractive alternative to existing estimators in the presence of multiple endogenous regressors. This is a situation that arises naturally when one endogenous variable is interacted with several other variables in a regression equation. In our simulations, the proposed method using MILP with a random starting point can reliably estimate regressions for a sample size of 500 with 20 endogenous variables in 5 seconds. Theoretical results for early termination of MILP are also provided. The second part of our proposal is a $k$-step correction framework, which is proved to be able to convert any point within a small but fixed neighborhood of the true parameter value into an estimate that is asymptotically equivalent to GMM. Our result does not require the initial estimate to be consistent and only $2\log n$ iterations are needed. Since the $k$-step correction does not require any optimization, applying the $k$-step correction to MILP estimate provides a computationally attractive way of obtaining efficient estimators. When dealing with very large data sets, we can run the MILP algorithm on only a small subsample and our theoretical results guarantee that the resulting estimator from the $k$-step correction is equivalent to computing GMM on the full sample. As a result, we can handle massive datasets of millions of observations within seconds. As an empirical illustration, we examine the heterogeneous treatment effect of Job Training Partnership Act (JTPA) using a regression with 13 interaction terms of the treatment variable."
An MCMC Algorithm for Estimating the Reduced RUM,"The RRUM is a model that is frequently seen in language assessment studies. The objective of this research is to advance an MCMC algorithm for the Bayesian RRUM. The algorithm starts with estimating correlated attributes. Using a saturated model and a binary decimal conversion, the algorithm transforms possible attribute patterns to a Multinomial distribution. Along with the likelihood of an attribute pattern, a Dirichlet distribution is used as the prior to sample from the posterior. The Dirichlet distribution is constructed using Gamma distributions. Correlated attributes of examinees are generated using the inverse transform sampling. Model parameters are estimated using the Metropolis within Gibbs sampler sequentially. Two simulation studies are conducted to evaluate the performance of the algorithm. The first simulation uses a complete and balanced Q-matrix that measures 5 attributes. Comprised of 28 items and 9 attributes, the Q-matrix for the second simulation is incomplete and imbalanced. The empirical study uses the ECPE data obtained from the CDM R package. Parameter estimates from the MCMC algorithm and from the CDM R package are presented and compared. The algorithm developed in this research is implemented in R."
Stretching p-wave molecules by transverse confinements,"We revisit the confinement-induced p-wave resonance in quasi-one-dimensional (quasi-1D) atomic gases and study the induced molecules near resonance. We derive the reduced 1D interaction parameters and show that they can well predict the binding energy of shallow molecules in quasi-1D system. Importantly, these shallow molecules are found to be much more spatially extended compared to those in three dimensions (3D) without transverse confinement. Our results strongly indicate that a p-wave interacting atomic gas can be much more stable in quasi-1D near the induced p-wave resonance, where most weight of the molecule lies outside the short-range regime and thus the atom loss could be suppressed."
A Conceptual Framework for Supporting a Rapid Design of Web Applications for Data Analysis of Electrical Quality Assurance Data for the LHC,"  The Large Hadron Collider (LHC) is one of the most complex machines ever build. It is composed of many components which constitute a large system. The tunnel and the accelerator is just one of a very critical fraction of the whole LHC infrastructure. Hardware comissioning as one of the critical processes before running the LHC is implemented during the Long Shutdown (LS) states of the macine, where Electrical Quality Assurance (ELQA) is one of its key components. Here a huge data is collected when implementing various ELQA electrical tests. In this paper we present a conceptual framework for supporting a rapid design of web applications for ELQA data analysis. We show a framework's main components, their possible integration with other systems and machine learning algorithms and a simple use case of prototyping an application for Electrical Quality Assurance of the LHC. "
The Parallel Meaning Bank: Towards a Multilingual Corpus of Translations Annotated with Compositional Meaning Representations,"The Parallel Meaning Bank is a corpus of translations annotated with shared, formal meaning representations comprising over 11 million words divided over four languages (English, German, Italian, and Dutch). Our approach is based on cross-lingual projection: automatically produced (and manually corrected) semantic annotations for English sentences are mapped onto their word-aligned translations, assuming that the translations are meaning-preserving. The semantic annotation consists of five main steps: (i) segmentation of the text in sentences and lexical items; (ii) syntactic parsing with Combinatory Categorial Grammar; (iii) universal semantic tagging; (iv) symbolization; and (v) compositional semantic analysis based on Discourse Representation Theory. These steps are performed using statistical models trained in a semi-supervised manner. The employed annotation models are all language-neutral. Our first results are promising."
A nonparametric copula approach to conditional Value-at-Risk,"  Value-at-Risk and its conditional allegory, which takes into account the available information about the economic environment, form the centrepiece of the Basel framework for the evaluation of market risk in the banking sector. In this paper, a new nonparametric framework for estimating this conditional Value-at-Risk is presented. A nonparametric approach is particularly pertinent as the traditionally used parametric distributions have been shown to be insufficiently robust and flexible in most of the equity-return data sets observed in practice. The method extracts the quantile of the conditional distribution of interest, whose estimation is based on a novel estimator of the density of the copula describing the dynamic dependence observed in the series of returns. Real-world back-testing analyses demonstrate the potential of the approach, whose performance may be superior to its industry counterparts. "
Towards High-quality Visualization of Superfluid Vortices,"  Superfluidity is a special state of matter exhibiting macroscopic quantum phenomena and acting like a fluid with zero viscosity. In such a state, superfluid vortices exist as phase singularities of the model equation with unique distributions. This paper presents novel techniques to aid the visual understanding of superfluid vortices based on the state-of-the-art non-linear Klein-Gordon equation, which evolves a complex scalar field, giving rise to special vortex lattice/ring structures with dynamic vortex formation, reconnection, and Kelvin waves, etc. By formulating a numerical model with theoretical physicists in superfluid research, we obtain high-quality superfluid flow data sets without noise-like waves, suitable for vortex visualization. By further exploring superfluid vortex properties, we develop a new vortex identification and visualization method: a novel mechanism with velocity circulation to overcome phase singularity and an orthogonal-plane strategy to avoid ambiguity. Hence, our visualizations can help reveal various superfluid vortex structures and enable domain experts for related visual analysis, such as the steady vortex lattice/ring structures, dynamic vortex string interactions with reconnections and energy radiations, where the famous Kelvin waves and decaying vortex tangle were clearly observed. These visualizations have assisted physicists to verify the superfluid model, and further explore its dynamic behavior more intuitively. "
Nonrepetitive edge-colorings of trees,"A repetition is a sequence of symbols in which the first half is the same as the second half. An edge-coloring of a graph is repetition-free or nonrepetitive if there is no path with a color pattern that is a repetition. The minimum number of colors so that a graph has a nonrepetitive edge-coloring is called its Thue edge-chromatic number. We improve on the best known general upper bound of $4\Delta-4$ for the Thue edge-chromatic number of trees of maximum degree $\Delta$ due to Alon, Grytczuk, Ha{\l}uszczak and Riordan (2002) by providing a simple nonrepetitive edge-coloring with $3\Delta-2$ colors."
On the new wave behavior to the longitudinal wave quation in a magneto-electro-elastic circular rod,"With the aid of the symbolic computations software; Wolfram Mathematica 9, the powerful sine-Gordon expansion method is used in examining the analytical solution of the longitudinal wave equation in a magneto-electro-elastic circular rod. Sine-Gordon expansion method is based on the well-known sine-Gordon equation and a wave transformation. The longitudinal wave equation is an equation that arises in mathematical physics with dispersion caused by the transverse Poisson's effect in a magneto-electro-elastic circular rod. We successfully get some solutions with the complex, trigonometric and hyperbolic function structure. We present the numerical simulations of all the obtained solutions by choosing appropriate values of the parameters. We give the physical meanings of some of the obtained analytical solutions which significantly explain some practical physical problems."
Formulation of Deep Reinforcement Learning Architecture Toward Autonomous Driving for On-Ramp Merge,"  Multiple automakers have in development or in production automated driving systems (ADS) that offer freeway-pilot functions. This type of ADS is typically limited to restricted-access freeways only, that is, the transition from manual to automated modes takes place only after the ramp merging process is completed manually. One major challenge to extend the automation to ramp merging is that the automated vehicle needs to incorporate and optimize long-term objectives (e.g. successful and smooth merge) when near-term actions must be safely executed. Moreover, the merging process involves interactions with other vehicles whose behaviors are sometimes hard to predict but may influence the merging vehicle optimal actions. To tackle such a complicated control problem, we propose to apply Deep Reinforcement Learning (DRL) techniques for finding an optimal driving policy by maximizing the long-term reward in an interactive environment. Specifically, we apply a Long Short-Term Memory (LSTM) architecture to model the interactive environment, from which an internal state containing historical driving information is conveyed to a Deep Q-Network (DQN). The DQN is used to approximate the Q-function, which takes the internal state as input and generates Q-values as output for action selection. With this DRL architecture, the historical impact of interactive environment on the long-term reward can be captured and taken into account for deciding the optimal control policy. The proposed architecture has the potential to be extended and applied to other autonomous driving scenarios such as driving through a complex intersection or changing lanes under varying traffic flow conditions. "
