Economic Factors of Vulnerability Trade and Exploitation,"  Cybercrime markets support the development and diffusion of new attack technologies, vulnerability exploits, and malware. Whereas the revenue streams of cyber attackers have been studied multiple times in the literature, no quantitative account currently exists on the economics of attack acquisition and deployment. Yet, this understanding is critical to characterize the production of (traded) exploits, the economy that drives it, and its effects on the overall attack scenario. In this paper we provide an empirical investigation of the economics of vulnerability exploitation, and the effects of market factors on likelihood of exploit. Our data is collected first-handedly from a prominent Russian cybercrime market where the trading of the most active attack tools reported by the security industry happens. Our findings reveal that exploits in the underground are priced similarly or above vulnerabilities in legitimate bug-hunting programs, and that the refresh cycle of exploits is slower than currently often assumed. On the other hand, cybercriminals are becoming faster at introducing selected vulnerabilities, and the market is in clear expansion both in terms of players, traded exploits, and exploit pricing. We then evaluate the effects of these market variables on likelihood of attack realization, and find strong evidence of the correlation between market activity and exploit deployment. We discuss implications on vulnerability metrics, economics, and exploit measurement. "
Complete classification of generalized crossing changes between GOF-knots,"  We show that the monodromy for a genus one, fibered knot can have at most two monodromy equivalence classes of once-unclean arcs. We use this to classify all monodromies of genus one, fibered knots that possess once-unclean arcs, all manifolds containing genus one fibered knots with generalized crossing changes resulting in another genus one fibered knot, and all generalized crossing changes between two genus one, fibered knots. "
Strain Mode of General Flow: Characterization and Implications for Flow Pattern Structures,"  Understanding the mixing capability of mixing devices based on their geometric shape is an important issue both for predicting mixing processes and for designing new mixers. The flow patterns in mixers are directly connected with the modes of the local strain rate, which is generally a combination of elongational flow and planar shear flow. We develop a measure to characterize the modes of the strain rate for general flow occurring in mixers. The spatial distribution of the volumetric strain rate (or non-planar strain rate) in connection with the flow pattern plays an essential role in understanding distributive mixing. With our measure, flows with different types of screw elements in a twin-screw extruder are numerically analyzed. The difference in flow pattern structure between conveying screws and kneading disks is successfully characterized by the distribution of the volumetric strain rate. The results suggest that the distribution of the strain rate mode offers an essential and convenient way for characterization of the relation between flow pattern structure and the mixer geometry. "
$\mathbb{Z}^2$-algebras as noncommutative blow-ups,"The goal of this note is to first prove that for a well behaved $\mathbb{Z}^2$-algebra $R$, the category $QGr(R) := Gr(R)/Tors(R)$ is equivalent to $QGr(R_\Delta)$ where $R_\Delta$ is a diagonal-like sub-$\mathbb{Z}$-algebra of $R$. Afterwards we use this result to prove that the $\mathbb{Z}^2$-algebras as introduced in [arXiv:1607.08383] are QGr-equivalent to a diagonal-like sub-$\mathbb{Z}$-algebra which is a simultaneous noncommutative blow-up of a quadratic and a cubic Sklyanin algebra. As such we link the noncommutative birational transformation and the associated $\mathbb{Z}^2$-algebras as appearing in the work of Van den Bergh and Presotto with the noncommutative blowups appearing in the work of Rogalski, Sierra and Stafford."
Deep Convolutional Neural Networks for Anomaly Event Classification on Distributed Systems,"The increasing popularity of server usage has brought a plenty of anomaly log events, which have threatened a vast collection of machines. Recognizing and categorizing the anomalous events thereby is a much salient work for our systems, especially the ones generate the massive amount of data and harness it for technology value creation and business development. To assist in focusing on the classification and the prediction of anomaly events, and gaining critical insights from system event records, we propose a novel log preprocessing method which is very effective to filter abundant information and retain critical characteristics. Additionally, a competitive approach for automated classification of anomalous events detected from the distributed system logs with the state-of-the-art deep (Convolutional Neural Network) architectures is proposed in this paper. We measure a series of deep CNN algorithms with varied hyper-parameter combinations by using standard evaluation metrics, the results of our study reveals the advantages and potential capabilities of the proposed deep CNN models for anomaly event classification tasks on real-world systems. The optimal classification precision of our approach is 98.14%, which surpasses the popular traditional machine learning methods."
Group-sparse block PCA and explained variance,"  The paper addresses the simultneous determination of goup-sparse loadings by block optimization, and the correlated problem of defining explained variance for a set of non orthogonal components. We give in both cases a comprehensive mathematical presentation of the problem, which leads to propose i) a new formulation/algorithm for group-sparse block PCA and ii) a framework for the definition of explained variance with the analysis of five definitions. The numerical results i) confirm the superiority of block optimization over deflation for the determination of group-sparse loadings, and the importance of group information when available, and ii) show that ranking of algorithms according to explained variance is essentially independant of the definition of explained variance. These results lead to propose a new optimal variance as the definition of choice for explained variance. "
Multi-Frequency Phase Synchronization,"  We propose a novel formulation for phase synchronization -- the statistical problem of jointly estimating alignment angles from noisy pairwise comparisons -- as a nonconvex optimization problem that enforces consistency among the pairwise comparisons in multiple frequency channels. Inspired by harmonic retrieval in signal processing, we develop a simple yet efficient two-stage algorithm that leverages the multi-frequency information. We demonstrate in theory and practice that the proposed algorithm significantly outperforms state-of-the-art phase synchronization algorithms, at a mild computational costs incurred by using the extra frequency channels. We also extend our algorithmic framework to general synchronization problems over compact Lie groups. "
A Bennequin-type inequality and combinatorial bounds,"  In this paper we provide a new Bennequin-type inequality for the Rasmussen- Beliakova-Wehrli invariant, featuring the numerical transverse braid invariants (the c-invariants) introduced by the author. From the Bennequin type-inequality, and a combinatorial bound on the value of the c-invariants, we deduce a new computable bound on the Rasmussen invariant. "
Thermal field theory of bosonic gases with finite-range effective interaction,"  We study a dilute and ultracold Bose gas of interacting atoms by using an effective field theory which takes account finite-range effects of the inter-atomic potential. Within the formalism of functional integration from the grand canonical partition function we derive beyond-mean-field analytical results which depend on both scattering length and effective range of the interaction. In particular, we calculate the equation of state of the bosonic system as a function of these interaction parameters both at zero and finite temperature including one-loop Gaussian fluctuation. In the case of zero-range effective interaction we explicitly show that, due to quantum fluctuations, the bosonic system is thermodynamically stable only for very small values of the gas parameter. We find that a positive effective range above a critical threshold is necessary to remove the thermodynamical instability of the uniform configuration. Remarkably, also for relatively large values of the gas parameter, our finite-range results are in quite good agreement with recent zero-temperature Monte Carlo calculations obtained with hard-sphere bosons. "
LtFi: Cross-technology Communication for RRM between LTE-U and IEEE 802.11,"Cross-technology communication (CTC) was proposed in recent literature as a way to exploit the opportunities of collaboration between heterogeneous wireless technologies. This paper presents LtFi, a system which enables to set-up a CTC between nodes of co-located LTE-U and WiFi networks. LtFi follows a two-step approach: using the air-interface LTE-U BSs are broadcasting connection and identification data to adjacent WiFi nodes, which is used to create a bi-directional control channel over the wired Internet. This way LtFi enables the development of advanced cross-technology interference and radio resource management schemes between heterogeneous WiFi and LTE-U networks. LtFi is of low complexity and fully compliant with LTE-U technology and works on WiFi side with COTS hardware. It was prototypically implemented and evaluated. Experimental results reveal that LtFi is able to reliably decoded the data transmitted over the LtFi air-interface in a crowded wireless environment at even very low LTE-U receive power levels of -92dBm. Moreover, results from system-level simulations show that LtFi is able to accurately estimate the set of interfering LTE-U BSs in a typical LTE-U multi-cell environment."
Multi-step Off-policy Learning Without Importance Sampling Ratios,"  To estimate the value functions of policies from exploratory data, most model-free off-policy algorithms rely on importance sampling, where the use of importance sampling ratios often leads to estimates with severe variance. It is thus desirable to learn off-policy without using the ratios. However, such an algorithm does not exist for multi-step learning with function approximation. In this paper, we introduce the first such algorithm based on temporal-difference (TD) learning updates. We show that an explicit use of importance sampling ratios can be eliminated by varying the amount of bootstrapping in TD updates in an action-dependent manner. Our new algorithm achieves stability using a two-timescale gradient-based TD update. A prior algorithm based on lookup table representation called Tree Backup can also be retrieved using action-dependent bootstrapping, becoming a special case of our algorithm. In two challenging off-policy tasks, we demonstrate that our algorithm is stable, effectively avoids the large variance issue, and can perform substantially better than its state-of-the-art counterpart. "
Atomic Ferris wheel beams,"  We study the generation of atom vortex beams in the case where an atomic wave-packet, moving in free space, is diffracted from a properly tailored light mask with a spiral transverse profile. We show how such a diffraction scheme could lead to the production of an atomic Ferris wheel beam. "
On the Limits of Learning Representations with Label-Based Supervision,"  Advances in neural network based classifiers have transformed automatic feature learning from a pipe dream of stronger AI to a routine and expected property of practical systems. Since the emergence of AlexNet every winning submission of the ImageNet challenge has employed end-to-end representation learning, and due to the utility of good representations for transfer learning, representation learning has become as an important and distinct task from supervised learning. At present, this distinction is inconsequential, as supervised methods are state-of-the-art in learning transferable representations. But recent work has shown that generative models can also be powerful agents of representation learning. Will the representations learned from these generative methods ever rival the quality of those from their supervised competitors? In this work, we argue in the affirmative, that from an information theoretic perspective, generative models have greater potential for representation learning. Based on several experimentally validated assumptions, we show that supervised learning is upper bounded in its capacity for representation learning in ways that certain generative models, such as Generative Adversarial Networks (GANs) are not. We hope that our analysis will provide a rigorous motivation for further exploration of generative representation learning. "
Coset space construction and inverse Higgs phenomenon for the conformal group,"  It is shown that conformally invariant theories can be obtained within the framework of the coset space construction. The corresponding technique is applicable for the construction of representations of the unbroken conformal group, as well as of a spontaneously broken one. A special role of the ""Nambu-Goldstone fields"" for special conformal transformations is clarified - they ensure self-consistency of a theory by guaranteeing that discrete symmetries are indeed symmetries of the theory. A generalization of the developed construction to a special class of symmetry groups with a non-linear realization of its discrete elements is given. Based on these results, the usage of the inverse Higgs constraints for the conformal group undergoing spontaneous symmetry breaking is questioned. "
"A spatial predictive model for Malaria resurgence in central Greece integrating entomological, environmental and Social data","Malaria constitutes an important cause of human mortality. After 2009 Greece experienced a resurgence of malaria. Here, we develop a modelbased framework that integrates entomological, geographical, social and environmental evidence in order to guide the mosquito control efforts and apply this framework to data from an entomological survey study conducted in Central Greece. Our results indicate that malaria transmission risk in Greece is potentially substantial. In addition, specific districts such as seaside, lakeside and rice field regions appear to represent potential malaria hotspots in Central Greece. We found that appropriate maps depicting the basic reproduction number, R0 , are useful tools for informing policy makers on the risk of malaria resurgence and can serve as a guide to inform recommendations regarding control measures."
Large-scale analysis of user exposure to online advertising in Facebook,"Online advertising is the major source of income for a large portion of Internet Services. There exists a body of literature aiming at optimizing ads engagement, understanding the privacy and ethical implications of online advertising, etc. However, to the best of our knowledge, no previous work analyses at large scale the exposure of real users to online advertising. This paper performs a comprehensive analysis of the exposure of users to ads and advertisers using a dataset including more than 7M ads from 140K unique advertisers delivered to more than 5K users that was collected between October 2016 and May 2018. The study focuses on Facebook, which is the second largest advertising platform only to Google in terms of revenue, and accounts for more than 2.2B monthly active users. Our analysis reveals that Facebook users are exposed (in median) to 70 ads per week, which come from 12 advertisers. Ads represent between 10% and 15% of all the information received in users' newsfeed. A small increment of 1% in the portion of ads in the newsfeed could roughly represent a revenue increase of 8.17M USD per week for Facebook. Finally, we also reveal that Facebook users are overprofiled since in the best case only 22.76% of the interests Facebook assigns to users for advertising purpose are actually related to the ads those users receive."
Concept Formation and Dynamics of Repeated Inference in Deep Generative Models,"  Deep generative models are reported to be useful in broad applications including image generation. Repeated inference between data space and latent space in these models can denoise cluttered images and improve the quality of inferred results. However, previous studies only qualitatively evaluated image outputs in data space, and the mechanism behind the inference has not been investigated. The purpose of the current study is to numerically analyze changes in activity patterns of neurons in the latent space of a deep generative model called a ""variational auto-encoder"" (VAE). What kinds of inference dynamics the VAE demonstrates when noise is added to the input data are identified. The VAE embeds a dataset with clear cluster structures in the latent space and the center of each cluster of multiple correlated data points (memories) is referred as the concept. Our study demonstrated that transient dynamics of inference first approaches a concept, and then moves close to a memory. Moreover, the VAE revealed that the inference dynamics approaches a more abstract concept to the extent that the uncertainty of input data increases due to noise. It was demonstrated that by increasing the number of the latent variables, the trend of the inference dynamics to approach a concept can be enhanced, and the generalization ability of the VAE can be improved. "
Lp-estimates for the square root of elliptic systems with mixed boundary conditions,"This article focuses on Lp-estimates for the square root of elliptic systems of second order in divergence form on a bounded domain. We treat complex bounded measurable coefficients and allow for mixed Dirichlet/Neumann boundary conditions on domains beyond the Lipschitz class. If there is an associated bounded semigroup on Lp0 , then we prove that the square root extends for all p $\in$ (p0, 2) to an isomorphism between a closed subspace of W1p carrying the boundary conditions and Lp. This result is sharp and extrapolates to exponents slightly above 2. As a byproduct, we obtain an optimal p-interval for the bounded H$\infty$-calculus on Lp. Estimates depend holomorphically on the coefficients, thereby making them applicable to questions of non-autonomous maximal regularity and optimal control. For completeness we also provide a short summary on the Kato square root problem in L2 for systems with lower order terms in our setting."
Ensemble of Thermostatically Controlled Loads: Statistical Physics Approach,"  Thermostatically Controlled Loads (TCL), e.g. air-conditioners and heaters, are by far the most wide-spread consumers of electricity. Normally the devices are calibrated to provide the so-called bang-bang control of temperature -- changing from on to off, and vice versa, depending on temperature. Aggregation of a large group of similar devices into a statistical ensemble is considered, where the devices operate following the same dynamics subject to stochastic perturbations and randomized, Poisson on/off switching policy. We analyze, using theoretical and computational tools of statistical physics, how the ensemble relaxes to a stationary distribution and establish relation between the relaxation and statistics of the probability flux, associated with devices' cycling in the mixed (discrete, switch on/off, and continuous, temperature) phase space. This allowed us to derive and analyze spectrum of the non-equilibrium (detailed balance broken) statistical system and uncover how switching policy affects oscillatory trend and speed of the relaxation. Relaxation of the ensemble is of a practical interest because it describes how the ensemble recovers from significant perturbations, e.g. forceful temporary switching off aimed at utilizing flexibility of the ensemble in providing ""demand response"" services relieving consumption temporarily to balance larger power grid. We discuss how the statistical analysis can guide further development of the emerging demand response technology. "
Automatic Document Image Binarization using Bayesian Optimization,"  Document image binarization is often a challenging task due to various forms of degradation. Although there exist several binarization techniques in literature, the binarized image is typically sensitive to control parameter settings of the employed technique. This paper presents an automatic document image binarization algorithm to segment the text from heavily degraded document images. The proposed technique uses a two band-pass filtering approach for background noise removal, and Bayesian optimization for automatic hyperparameter selection for optimal results. The effectiveness of the proposed binarization technique is empirically demonstrated on the Document Image Binarization Competition (DIBCO) and the Handwritten Document Image Binarization Competition (H-DIBCO) datasets. "
Vibrationally resolved electronic spectra including vibrational pre-excitation: Theory and application to VIPER spectroscopy,"Vibrationally resolved electronic absorption spectra including the effect of vibrational pre-excitation are computed in order to interpret and predict vibronic transitions that are probed in the Vibrationally Promoted Electronic Resonance (VIPER) experiment [L. J. G. W. van Wilderen et al., Angew. Chem. Int. Ed. 53, 2667 (2014)]. To this end, we employ time-independent and time-dependent methods based on the evaluation of Franck-Condon overlap integrals and Fourier transformation of time-domain wavepacket autocorrelation functions, respectively. The time-independent approach uses a generalized version of the FCclasses method [F. Santoro et al., J. Chem. Phys. 126, 084509 (2007)]. In the time-dependent approach, autocorrelation functions are obtained by wavepacket propagation and by evaluation of analytic expressions, within the harmonic approximation including Duschinsky rotation effects. For several medium-sized polyatomic systems, it is shown that selective pre-excitation of particular vibrational modes leads to a red-shift of the low-frequency edge of the electronic absorption spectrum, which is a prerequisite for the VIPER experiment. This effect is typically most pronounced upon excitation of ring distortion modes within an aromatic pi-system. Theoretical predictions as to which modes show the strongest VIPER effect are found to be in excellent agreement with experiment."
Modular Multi-Objective Deep Reinforcement Learning with Decision Values,"In this work we present a method for using Deep Q-Networks (DQNs) in multi-objective environments. Deep Q-Networks provide remarkable performance in single objective problems learning from high-level visual state representations. However, in many scenarios (e.g in robotics, games), the agent needs to pursue multiple objectives simultaneously. We propose an architecture in which separate DQNs are used to control the agent's behaviour with respect to particular objectives. In this architecture we introduce decision values to improve the scalarization of multiple DQNs into a single action. Our architecture enables the decomposition of the agent's behaviour into controllable and replaceable sub-behaviours learned by distinct modules. Moreover, it allows to change the priorities of particular objectives post-learning, while preserving the overall performance of the agent. To evaluate our solution we used a game-like simulator in which an agent - provided with high-level visual input - pursues multiple objectives in a 2D world."
Coupled conditional backward sampling particle filter,"  Unbiased estimation for hidden Markov models has been recently proposed by Jacob et al (to appear), using a coupling of two conditional particle filters (CPFs). Unbiased estimation has many advantages, such as enabling the construction of asymptotically exact confidence intervals and straightforward parallelisation. In this work we propose a new coupling of two CPFs, for unbiased estimation, that uses backward sampling steps, which is an important efficiency enhancing technique in particle filtering. We show that this coupled conditional backward sampling particle filter (CCBPF) algorithm has better stability properties, in the sense that with fixed number of particles, the coupling time in terms of iterations increases only linearly with respect to the time horizon under a general (strong mixing) condition. In contrast, current coupled CPFs require the particle number to increase with the horizon length. An important corollary of our results is a new quantitative bound for the convergence rate of the popular backward sampling conditional particle filter. Previous theoretical results have not been able to demonstrate the improvement brought by backward sampling to the CPF, whereas we provide rates showing that backward sampling ensures that the CPF can remain effective with a fixed number of particles independent of the time horizon. "
