Mechanomyography based closed loop Functional Electrical Stimulation cycling system,"Functional Electrical Stimulation (FES) systems successful restoring motor function supporting paralyzed users. Commercially available FES products open loop, meaning system unable adapt changing conditions user their muscles results muscle fatigue poor stimulation protocols. because difficult close loop between stimulation monitoring muscle contraction using adaptive stimulation. FES causes electrical artefacts make challenging monitor muscle contractions traditional methods electromyography (EMG). look overcome limitation combining FES novel mechanomyographic (MMG) sensors able monitor muscle activity during stimulation real time. provide meaningful task built FES cycling rig software interface enabled perform adaptive recording stimulation, then combine sensors record forces applied pedals using force sensitive resistors (FSRs), crank angle position using magnetic incremental encoder inputs user using switches potentiometer. illustrated closed loop stimulation algorithm used inputs sensors control output programmable RehaStim 1 FES stimulator (Hasomed) real time. recumbent bicycle rig used testing platform FES cycling. algorithm designed respond change requested speed (RPM) user change stimulation power (% maximum current mA) until speed achieved then maintain  ."
QT2S: System Monitoring Road Traffic via Fine Grounding Tweets,"Social media platforms provide continuous access user generated content enables real time monitoring user behavior events. geographical dimension user behavior events recently caught lot attention several domains: mobility, humanitarian, infrastructural. While resolving location user straightforward, depending affordances their device and/or application they using, most cases, locating user demands larger effort, exploiting textual features. Twitter instance, 2% all tweets geo referenced. paper, present system zoomed grounding (below city level) short messages (e.g., tweets). system combines different natural language processing machine learning techniques increase number geo grounded tweets, essential applications disaster response real time traffic monitoring."
 Benchmark Dose Finding Studies Continuous Outcomes," important tool evaluate performance any design optimal benchmark proposed O'Quigley (2002, Biostatistics 3(1), 51 56) provides upper bound performance design under given scenario. original benchmark applied dose finding studies binary endpoint  . However, growing interest dose finding studies involving continuous outcomes, but no benchmark studies developed. show original benchmark extension Cheung (2014, Biometrics 70(2), 389 397), looked different perspective, generalised various settings several discrete continuous outcomes. illustrate compare benchmark performance setting Phase I clinical trial continuous toxicity endpoint setting Phase I/II clinical trial continuous efficacy outcome. show proposed benchmark provides accurate upper bound model based dose finding methods serves powerful tool evaluating designs."
Wavefront retrieval through random pupil plane phase probes: Gerchberg Saxton approach," pupil plane wavefront reconstruction procedure proposed based analysis sequence focal plane images corresponding sequence random pupil plane phase probes. developed method provides unique nontrivial solution wavefront retrieval problem shows global convergence solution demonstrated using Gerchberg Saxton implementation. method general used any optical system includes deformable mirrors active/adaptive wavefront correction. presented numerical simulation lab experimental results show low noise sensitivity, high reliability robustness proposed approach high quality optical wavefront restoration. Laboratory experiments shown $\lambda$/14 rms accuracy retrieval poked DM actuator fiducial pattern spatial resolution 20 30$~\mu$m comparable accuracy direct high resolution interferometric measurements."
Uplink Non Orthogonal Multiple Access 5G Wireless Networks," Orthogonal Frequency Division Multiple Access (OFDMA) well other orthogonal multiple access techniques fail achieve system capacity limit uplink due exclusivity resource allocation. issue more prominent fairness among users considered system. Current Non Orthogonal Multiple Access (NOMA) techniques introduce redundancy coding/spreading facilitate users' signals separation receiver, degrade system spectral efficiency. Hence, order achieve higher capacity, more efficient NOMA schemes need developed. paper, propose NOMA scheme uplink removes resource allocation exclusivity allows more one user share same subcarrier without any coding/spreading redundancy. Joint processing implemented receiver detect users' signals. However, control receiver complexity, upper limit number users per subcarrier needs imposed. addition, novel subcarrier power allocation algorithm proposed new NOMA scheme maximizes users' sum rate. link level performance evaluation shown proposed scheme achieves bit error rate close single user case. Numerical results show proposed NOMA scheme significantly improve system performance terms spectral efficiency fairness comparing OFDMA. "
Epsilon approximations epsilon nets, use random samples approximate properties geometric configurations influential idea both combinatorial algorithmic purposes. chapter considers two related notions $\epsilon$ approximations $\epsilon$ nets  capture most important quantitative properties one would expect random sample respect underlying geometric configuration. 
 continuous framework fairness," Increasingly, discrimination algorithms perceived societal legal problem. response, number criteria implementing algorithmic fairness machine learning developed literature. paper proposes Continuous Fairness Algorithm (CFA$\theta$) enables continuous interpolation between different fairness definitions. More specifically, make three main contributions existing literature. First, approach allows decision maker continuously vary between concepts individual group fairness. consequence, algorithm enables decision maker adopt intermediate ""worldviews"" degree discrimination encoded algorithmic processes, adding nuance extreme cases "" 're all equal"" (WAE) ""what you see what you get"" (WYSIWYG) proposed so far literature. Second, use optimal transport theory, specifically concept barycenter, maximize decision maker utility under chosen fairness constraints. Third, algorithm able handle cases intersectionality, i.e., multi dimensional discrimination certain groups grounds several criteria. discuss three main examples (college admissions; credit application; insurance contracts) map out policy implications approach. explicit formalization trade off between individual group fairness allows post processing approach tailored different situational contexts one other fairness criterion may take precedence. "
Counting Subwords Occurrences Base b Expansions," count number distinct (scattered) subwords occurring base b expansion non negative integers. More precisely, consider sequence $(S_b(n))_{n\ge 0}$ counting number positive entries each row generalization Pascal triangle binomial coefficients base $b$ expansions. using convenient tree structure, provide recurrence relations $(S_b(n))_{n\ge 0}$ leading $b$ regularity latter sequence. Then deduce asymptotics summatory function sequence $(S_b(n))_{n\ge 0}$."
Tensor Renormalization Group Randomized Singular Value Decomposition," algorithm tensor renormalization group proposed based randomized algorithm singular value decomposition. algorithm applicable broad range two dimensional classical models. case square lattice, computational complexity memory usage proportional fifth third power bond dimension, respectively, whereas those conventional implementation sixth fourth power. oversampling parameter larger bond dimension sufficient reproduce same result full singular value decomposition even critical point two dimensional Ising model. "
Cohomology symplectic groups Meyer's signature theorem,"Meyer showed signature closed oriented surface bundle surface multiple $4$, computed using element $H^2(\mathsf{Sp}(2g, \mathbb{Z}),\mathbb{Z})$. Denoting $1 \ \mathbb{Z} \ \widetilde{\mathsf{Sp}(2g,\mathbb{Z})} \ \mathsf{Sp}(2g,\mathbb{Z}) \ 1$ pullback universal cover $\mathsf{ Sp}(2g,\mathbb{R})$, Deligne proved every finite index subgroup $\widetilde{\mathsf {Sp}(2g, \mathbb{Z})}$ contains $2\mathbb{Z}$. consequence, class second cohomology any finite quotient $\mathsf{Sp}(2g, \mathbb{Z})$ most enable compute signature surface bundle modulo $8$. show fact possible investigate smallest quotient $\mathsf{Sp}(2g, \mathbb{Z})$ contains information. quotient $\mathfrak{H}$ non split extension $\mathsf {Sp}(2g,2)$ elementary abelian group order $2^{2g+1}$. central extension $1\ \mathbb{Z}/2\ \tilde{\mathfrak{H}}\ \mathfrak{H}\ 1$, $\tilde{\mathfrak{H}}$ appears quotient metaplectic double cover $\mathsf{Mp}(2g,\mathbb{Z})=\widetilde{\mathsf{Sp}(2g,\mathbb{Z})}/2\mathbb{Z}$. extension $\mathsf{Sp}(2g,2)$ almost extraspecial group order $2^{2g+2}$, faithful irreducible complex representation dimension $2^g$. Provided $g\ge 4$, $\widetilde{\mathfrak{H}}$ universal central extension $\mathfrak{H}$. Putting all together, provide recipe computing signature modulo $8$, indicate consequences."
 Newman  Shapiro problem," give negative answer Newman  Shapiro problem weighted approximation entire functions formulated 1966 motivated theory operators Fock space. exists function Fock space exponential multiples approximate entire multiples space. Furthermore, establish several positive results under different restrictions function question."
randUTV: blocked randomized algorithm computing rank revealing UTV factorization," manuscript describes randomized algorithm randUTV computing so called UTV factorization efficiently. Given matrix $A$, algorithm computes factorization $ = UTV^{*}$, $U$ $V$ orthonormal columns, $T$ triangular (either upper lower, whichever preferred). algorithm randUTV developed primarily fast easily parallelized alternative algorithms computing Singular Value Decomposition (SVD). randUTV provides accuracy very close SVD problems low rank approximation, solving ill conditioned linear systems, determining bases various subspaces associated matrix, etc. Moreover, randUTV produces highly accurate approximations singular values $A$. Unlike SVD, randomized algorithm proposed builds UTV factorization incremental, single stage, non iterative way, making possible halt factorization process once specified tolerance met. Numerical experiments comparing accuracy speed randUTV SVD presented. These experiments demonstrate comparison column pivoted QR, another factorization often used relatively economic alternative SVD, randUTV compares favorably terms speed while providing far higher accuracy. "
"Continuity nonlinear eigenvalues $CD(K,\infty)$ spaces respect measured Gromov Hausdorff convergence"," note prove nonlinear setting $CD(K,\infty)$ spaces stability Krasnoselskii spectrum Laplace operator $ \Delta$ under measured Gromov Hausdorff convergence, under additional compactness assumption satisfied, instance, sequences $CD^*(K,N)$ metric measure spaces uniformly bounded diameter. Additionally, show every element $\lambda$ Krasnoselskii spectrum indeed eigenvalue, namely exists nontrivial $u$ satisfying eigenvalue equation $  \Delta u = \lambda u$. "
Modeling WiFi Traffic White Space Prediction Wireless Sensor Networks,"Cross Technology Interference (CTI) prevalent phenomenon 2.4 GHz unlicensed spectrum causing packet losses increased channel contention. particular, WiFi interference severe problem low power wireless networks presence causes significant degradation overall performance. paper, propose proactive approach based WiFi interference modeling accurately predicting transmission opportunities low power wireless networks. leverage statistical analysis real world WiFi traces learn aggregated traffic characteristics terms Inter Arrival Time (IAT) , once captured into specific 2nd order Markov Modulated Poisson Process (MMPP(2)) model, enable accurate estimation interference. further use hidden Markov model (HMM) channel occupancy prediction. evaluated performance i) MMPP(2) traffic model w.r.t. real world traces existing Pareto model accurately characterizing WiFi traffic and, ii) compared HMM based white space prediction random channel access. report encouraging results using interference modeling white space prediction."
Dyson models under renormalization weak fields," consider one dimensional long range spin models (usually called Dyson models), consisting Ising ferromagnets slowly decaying long range pair potentials form $\frac{1}{|i j|^{\alpha}}$ mainly focusing range slow decays $1 < \alpha \leq 2$. describe two recent results, one about renormalization one about effect external fields low temperature. first result states decimated long range Gibbs measure one dimension becomes non Gibbsian, same vein comparable results higher dimensions short range models. second result addresses behaviour models under inhomogeneous fields, particular external fields decay zero polynomially $(|i|+1)^{  \gamma}$. study critical decay power field, $\gamma$, phase transition persists decay power $\alpha$ Dyson model compare, extending recent results short range models lattices trees. briefly point out analogies between these results."
Coupling geometry binary bipartite networks: hypotheses testing pattern geometry nestedness," Upon matrix representation binary bipartite network, via permutation invariance, coupling geometry computed approximate minimum energy macrostate network's system. macrostate supposed constitute intrinsic structures system, so coupling geometry should taken information contents, even nonparametric minimum sufficient statistics network data. Then pertinent null alternative hypotheses, nestedness, formulated according macrostate. is, any efficient testing statistic needs function coupling geometry. These conceptual architectures mechanisms large still missing community ecology literature, rendered misconceptions prevalent research area. Here algorithmically computed coupling geometry shown consisting deterministic multiscale block patterns, framed two marginal ultrametric trees row column axes, stochastic uniform randomness within each block found finest scale. Functionally series increasingly larger ensembles matrix mimicries derived conforming multiscale block configurations. Here matrix mimicking meant subject constraints row column sums sequences. Based series ensembles, profile distributions becomes natural device checking validity testing statistics structural indexes. energy based index used testing whether network data indeed contains structural geometry. new version block based nestedness index proposed. validity checked compared existing ones. computing paradigm, called Data Mechanics, application one real data network illustrated throughout developments discussions paper. "
"MUSE inspired view quasar Q2059 360, Lyman alpha blob, neighborhood"," radio quiet quasar Q2059 360 redshift $z=3.08$ known close small Lyman $\alpha$ blob (LAB) absorbed proximate damped Ly$\alpha$ (PDLA) system. Here, present Multi Unit Spectroscopic Explorer (MUSE) integral field spectroscopy follow up quasi stellar object (QSO). primary goal characterize LAB detail mapping both spatially spectrally using Ly$\alpha$ line, looking high ionization lines constrain emission mechanism. Combining high sensitivity MUSE integral field spectrograph mounted Yepun telescope ESO VLT natural coronagraph provided PDLA, map LAB down QSO position, after robust subtraction QSO light spectral domain. addition confirming earlier results small bright component LAB, unveil faint filamentary emission protruding south about 80 pkpc (physical kpc); results total size about 120 pkpc. derive velocity field LAB (assuming no transfer effects) map Ly$\alpha$ line width. Upper limits set flux N V $\lambda 1238 1242$, C IV $\lambda 1548 1551$, He II $\lambda 1640$, C III] $\lambda 1548 1551$ lines. discovered two probable Ly$\alpha$ emitters same redshift LAB projected distances 265 kpc 207 kpc QSO; their Ly$\alpha$ luminosities might well enhanced QSO radiation. find emission line galaxy $z=0.33$ near line sight QSO. LAB shares same general characteristics 17 surrounding radio quiet QSOs presented previously. However, indications may centered PDLA galaxy rather QSO."
Community Detection Euclidean Random Graphs," study problem community detection (CD) Euclidean random geometric graphs each vertex two latent variables: binary community label $\mathbb{R}^d$ valued location label forms support Poisson point process intensity $\lambda$. random graph then drawn edge probabilities dependent both community location labels. contrast stochastic block model (SBM) no location labels, resulting random graph contains more short loops due geometric embedding. consider recovery community labels, partial exact, using random graph location labels. establish phase transitions both sparse logarithmic degree regimes, provide bounds location thresholds, conjectured tight case exact recovery. show threshold distinguishability problem, i.e., testing between model null model without community labels exhibits no phase transition particular, does match weak recovery threshold (  contrast SBM). "
Load balancing heterogeneous schedulers,"Load balancing common approach web server farms inventory routing problems. important issue systems determine server incoming request should routed optimize given performance criteria. paper, assume server's scheduling disciplines heterogeneous. More precisely, server implements scheduling discipline belongs class limited processor sharing (LPS $d$) scheduling disciplines. Under LPS $d$, up $d$ jobs served simultaneously, hence, includes special cases First Come First Served ($d=1$) Processor Sharing ($d=\infty$). order obtain efficient heuristics, model above load balancing framework multi armed restless bandit problem. Using relaxation technique, first developed seminal work Whittle, derive Whittle's index policy general cost functions obtain closed form expression Whittle's index terms steady state distribution. Through numerical computations, investigate performance Whittle's index two different performance criteria: linear cost criterion cost criterion depends first second moment throughput. results show \emph{(i)} structure Whittle's index policy strongly depend scheduling discipline implemented server, i.e., $d$, \emph{(ii)} Whittle's index policy significantly outperforms standard dispatching rules Join Shortest Queue (JSQ), Join Shortest Expected Workload (JSEW), Random Server allocation (RSA)."
 Information Theoretic Framework Active De anonymization Social Networks Based Group Memberships," paper, new mathematical formulation problem de anonymizing social network users actively querying their membership social network groups introduced. formulation, attacker access noisy observation group membership each user social network. unidentified victim visits malicious website, attacker uses browser history sniffing make queries regarding victim's social media activity. Particularly, make polar queries regarding victim's group memberships victim's identity. attacker receives noisy responses her queries. goal de anonymize victim minimum number queries. Starting rigorous mathematical model active de anonymization problem, upper bound attacker's expected query cost derived, new attack algorithms proposed achieve bound. These algorithms vary computational cost performance. results suggest prior heuristic approaches problem provide sub optimal solutions. "
Geobiodynamics Roegenian Economic Systems," mathematical essay brings together ideas Economics, Geobiodynamics Thermodynamics. purpose obtain real models complex evolutionary systems. More specifically, essay defines Roegenian Economy links Geobiodynamics Roegenian Economy. context, discuss isomorphism between concepts techniques Thermodynamics Economics. Then describe Roegenian economic system like Carnot group. After analyse phase equilibrium two heterogeneous economic systems. European Union Economics appears like Cartesian product Roegenian economic systems Balance analysed details. Section end describes ""economic black holes"" small parts global economic system national income so great causes poor enrichment. These ideas used improve knowledge understanding nature development evolution thermodynamic economic systems. "
 effects overshooting convective core main sequence turnoffs young  intermediate age star clusters,"Recent investigations shown extended main sequence turnoffs (eMSTOs) common feature intermediate age star clusters Magellanic Clouds. eMSTOs found color magnitude diagram (CMD) young age star clusters. origin eMSTOs still open question. Moreover, asteroseismology shows value overshooting parameter $\delta_{\rm ov}$ convective core fixed stars approximatelly equal mass. Thus MSTO star clusters may affected overshooting convective core (OVCC). calculated effects OVCC different $\delta_{\rm ov}$ MSTO young  intermediate age star clusters. \textbf{If $\delta_{\rm ov}$ varies between stars cluster,} observed eMSTOs young  intermediate age star clusters explained well effects. equivalent age spreads MSTO caused OVCC related age star clusters good agreement observed results clusters. Moreover, observed eMSTOs NGC 1856 reproduced coeval populations different $\delta_{\rm ov}$. eMSTOs star clusters may relevant effects OVCC. effects OVCC \textbf{are similar rotation respects. But effects cannot result significant split main sequence young star clusters $m_{U}\lesssim 21$.} presence rapid rotation make split main sequence young star clusters more significant."
First eigenvalue estimates Dirichlet Neumann operators graphs,"Following Escobar [Esc97] Jammes [Jam15], introduce two types isoperimetric constants give lower bound estimates first nontrivial eigenvalues Dirichlet Neumann operators finite graphs boundary respectively."
Air burst Generated Tsunamis," paper examines questions whether smaller asteroids burst air water generate tsunamis could pose threat distant locations. air burst generated tsunamis qualitatively different more frequently studied earthquake generated tsunamis, differ well impact asteroids. Numerical simulations presented using shallow water equations several settings, demonstrating very little tsunami threat scenario. model problem explicit solution demonstrates explains same phenomena found computations analyzed. discuss question whether compressibility dispersion important effects should included, show results more sophisticated model problem using linearized Euler equations begins addresses this. "
 new design principle robust onion like networks self organized growth," Today's economy, production activity, life sustained social technological network infrastructures, while new threats network attacks destructing loops found recently network science. inversely take into account weakness, propose new design principle incrementally growing robust networks. networks self organized enhancing interwoven long loops. particular, consider range limited approximation linking intermediations few hops, show strong robustness growth without degrading efficiency paths. Moreover, demonstrate tolerance connectivity reformable even extremely vulnerable real networks according proposed growing process investment. These results may indicate prospective direction future growth network infrastructures. "
Surrogate Losses Online Learning Stepsizes Stochastic Non Convex Optimization," Stochastic Gradient Descent (SGD) played central role machine learning. However, requires carefully hand picked stepsize fast convergence, notoriously tedious time consuming tune. last several years, plethora adaptive gradient based algorithms emerged ameliorate problem. They proved efficient reducing labor tuning practice, but them lack theoretic guarantees even convex setting. paper, propose new surrogate losses cast problem learning optimal stepsizes stochastic optimization non convex smooth objective function onto online convex optimization problem. allows use no regret online algorithms compute optimal stepsizes fly. turn, results SGD algorithm self tuned stepsizes guarantees convergence rates automatically adaptive level noise. "
  Categorical Time Series Models Covariates," study problem stationarity ergodicity autoregressive multinomial logistic time series models possibly include latent process defined GARCH type recursive equation. improve considerably upon existing results related stationarity ergodicity conditions models. Proofs based theory developed chains complete connections. approach based useful coupling technique utilized studying ergodicity more general finite state stochastic processes. processes generalize finite state Markov chains assuming infinite order models past values. finite order Markov chains, discuss ergodicity properties strongly exogenous covariates considered dynamics process. "
