Layered Coding Energy Harvesting Communication Without CSIT," Due stringent constraints resources, may infeasible acquire current channel state information transmitter energy harvesting communication systems. paper, optimize energy harvesting transmitter, communicating slow fading channel, using layered coding. transmitter access channel statistics, but does know exact channel state. layered coding, codewords first designed each channel states different rates, then codewords either time multiplexed superimposed before transmission, leading two transmission strategies. receiver then decodes information adaptively based realized channel state. transmitter equipped finite capacity battery having non zero internal resistance. each transmission strategies, first formulate study average rate maximization problem non causal knowledge harvested power variations. Further, assuming statistical knowledge causal information harvested power variations, propose sub optimal algorithm, compare stochastic dynamic programming based solution greedy policy. "
 automorphisms Petit's algebras,"Let $\sigma$ automorphism field $K$ fixed field $F$. study automorphisms nonassociative unital algebras canonical generalizations associative quotient algebras $K[t;\sigma]/fK[t;\sigma]$ obtained twisted polynomial $f\  K[t;\sigma]$ invariant, first defined Petit. compute all their automorphisms if $\sigma$ commutes all automorphisms ${\rm Aut}_F(K)$ $n\geq m 1$, $n$ order $\sigma$ $m$ degree $f$,and obtain partial results $n<m 1$. case $K/F$ finite Galois field extension, obtain more detailed information structure automorphism groups these nonassociative unital algebras $F$. briefly investigate two algebras isomorphic."
 convolutional autoencoder approach mining features cellular electron cryo tomograms weakly supervised coarse segmentation,"Cellular electron cryo tomography enables 3D visualization cellular organization near native state submolecular resolution. However, contents cellular tomograms often complex, making difficult automatically isolate different situ cellular components. paper, propose convolutional autoencoder based unsupervised approach provide coarse grouping 3D small subvolumes extracted tomograms. demonstrate autoencoder used efficient coarse characterization features macromolecular complexes surfaces, membranes. addition, autoencoder used detect non cellular features related sample preparation data collection, carbon edges grid tomogram boundaries. autoencoder able detect patterns may indicate spatial interactions between cellular components. Furthermore, demonstrate autoencoder used weakly supervised semantic segmentation cellular components, requiring very small amount manual annotation."
Probabilistic Rule Realization Selection," Abstraction realization bilateral processes key deriving intelligence creativity. domains, two processes approached through rules: high level principles reveal invariances within similar diverse examples. Under probabilistic setting discrete input spaces, focus rule realization problem generates input sample distributions follow given rules. More ambitiously, go beyond mechanical realization takes whatever given, but instead ask proactively selecting reasonable rules realize. goal demanding practice, since initial rule set may always consistent thus intelligent compromises needed. formulate both rule realization selection two strongly connected components within single symmetric bi convex problem, derive efficient algorithm works large scale. Taking music compositional rules main example throughout paper, demonstrate model's efficiency music realization (composition) but music interpretation understanding (analysis). "
Asymptotic numerical analysis porous medium model transpiration driven sap flow trees," develop 3D porous medium model sap flow within tree stem, consists nonlinear parabolic partial differential equation suitable transpiration source term. Using asymptotic analysis, derive approximate series solutions liquid saturation sap velocity general class coefficient functions. Several important non dimensional parameters identified used characterize various flow regimes. investigate relative importance stem aspect ratio versus anisotropy sapwood hydraulic conductivity, these two effects impact radial vertical components sap velocity. analytical results validated means second order finite volume discretization governing equations, comparisons drawn experimental results Norway spruce trees."
Risk Estimators Choosing Regularization Parameters Ill Posed Problems Properties Limitations," paper discusses properties certain risk estimators recently proposed choose regularization parameters ill posed problems. simple approach Stein's unbiased risk estimator (SURE), estimates risk data space, while recent modification (GSURE) estimates risk space unknown variable. seems intuitive latter more appropriate ill posed problems, since properties data space tell much about quality reconstruction. provide theoretical studies both estimators linear Tikhonov regularization finite dimensional setting estimate quality risk estimators, leads asymptotic convergence results dimension problem tends infinity. Unlike previous papers, who studied image processing problems very low degree ill posedness, interested behavior risk estimators increasing ill posedness. Interestingly, theoretical results indicate quality GSURE risk deteriorate asymptotically ill posed problems, confirmed detailed numerical study. latter shows cases GSURE estimator leads extremely small regularization parameters, obviously cannot stabilize reconstruction. Similar but less severe issues respect robustness appear SURE estimator, comparison rather conservative discrepancy principle leads conclusion regularization parameter choice based unbiased risk estimation reliable procedure ill posed problems. similar numerical study sparsity regularization demonstrates same issue appears nonlinear variational regularization approaches. "
Analyzing Effects Seasonal Variations Wind Generation Load Voltage Profiles," paper presents methodology building daily profiles wind generation load different seasons assess their impacts voltage violations. measurement based wind models showed very high accuracy validated against several years actual wind power data. System load modeling carried out analyzing seasonal trends occur residential, commercial, industrial loads. proposed approach implemented IEEE 118 bus system, could identify violations bus voltage profiles season independent model could capture. results proposed approach expected provide better visualization problems seasonal variations wind power load might cause electric power grid."
Imitation Learning Imperfect Demonstration,"Imitation learning (IL) aims learn optimal policy demonstrations. However, demonstrations often imperfect since collecting optimal ones costly. effectively learn imperfect demonstrations, propose novel approach utilizes confidence scores, describe quality demonstrations. More specifically, propose two confidence based IL methods, namely two step importance weighting IL (2IWIL) generative adversarial IL imperfect demonstration confidence (IC GAIL). show confidence scores given small portion sub optimal demonstrations significantly improve performance IL both theoretically empirically."
 Bounds Binary LCD Codes," linear code complementary dual (or LCD code) defined linear code $C$ whose dual code $C^{\perp}$ satisfies $C \cap C^{\perp}$= $\left\{ \mathbf{0}\right\} $. Let $LCD{[}n,k{]}$ denote maximum possible values $d$ among $[n,k,d]$ binary LCD codes. give exact values $LCD{[}n,k{]}$ $1 \le k \le n \le 12$. show $LCD[n,n i]=2$ any $i\geq2$ $n\geq2^{i}$. Furthermore, show $LCD[n,k]\leq LCD[n,k 1]$ $k$ odd $LCD[n,k]\leq LCD[n,k 2]$ $k$ even."
Control Oriented Learning Fly," paper focuses developing strategy control systems whose dynamics almost entirely unknown. situation arises naturally scenario system undergoes critical failure. case, imperative retain ability satisfy basic control objectives order avert imminent catastrophe. prime example objective reach avoid problem, system needs move certain state constrained state space. deal limitations knowledge system dynamics, develop theory myopic control. primary goal myopic control , any given time, optimize current direction system trajectory, given solely information obtained about system until time. propose algorithm uses small perturbations control effort learn local dynamics while simultaneously ensuring system moves direction appears nearly optimal, provide hard bounds suboptimality. additionally verify usefulness algorithm simulation damaged aircraft seeking avoid crash, well example Van der Pol oscillator. "
Multi Agent Driven Data Mining Knowledge Discovery Cloud Computing," Today, huge amount data available web. Now need convert data knowledge useful different purposes. paper depicts use data mining process, OLAP combination multi agent system find knowledge data cloud computing. this, I am trying explain one case study online shopping one Bakery Shop. May increase sale items using model, I am trying represent. "
Matrix Completion $O(n)$ Samples Linear Time," consider problem reconstructing rank $k$ $n \times n$ matrix $M$ sampling entries. Under certain incoherence assumption $M$ case both rank condition number $M$ bounded, shown \cite{CandesRecht2009, CandesTao2010, keshavan2010, Recht2011, Jain2012, Hardt2014} $M$ recovered exactly approximately (depending trade off between accuracy computational complexity) using $O(n \, \text{poly}(\log n))$ samples super linear time $O(n^{a} \, \text{poly}(\log n))$ constant $ \geq 1$. paper, propose new matrix completion algorithm using novel sampling scheme based union independent sparse random regular bipartite graphs. show under same conditions w.h.p. algorithm recovers $\epsilon$ approximation $M$ terms Frobenius norm using $O(n \log^2(1/\epsilon))$ samples linear time $O(n \log^2(1/\epsilon))$. provides best known bounds both sample complexity computational complexity reconstructing (approximately) unknown low rank matrix. novelty algorithm two new steps thresholding singular values rescaling singular vectors application ""vanilla"" alternating minimization algorithm. structure sparse random regular graphs used heavily controlling impact these regularization steps."
"Ingestion, Indexing Retrieval High Velocity Multidimensional Sensor Data Single Node"," Multidimensional data becoming more prevalent, partly due rise Internet Things (IoT), need ingest analyze data streams rates higher before. industrial IoT applications require ingesting millions records per second, while processing queries recently ingested historical data. Unfortunately, existing database systems suited multidimensional data exhibit low per node ingestion performance, even if they scale horizontally distributed settings, they require large number nodes meet ingest demands. reason, paper evaluate single node multidimensional data store high velocity sensor data. design centers around two level indexing structure, wherein global index memory R* tree local indices serialized kd trees. study confined records numerical indexing fields range queries, covers ingest throughput, query response time, storage footprint. show adopted design streamlines data ingestion offers ingress rates two orders magnitude higher those Percona Server, SQLite, Druid. prototype reports query response times comparable better those Percona Server Druid, compares favorably terms storage footprint. addition, evaluate kd tree partitioning based scheme grouping incoming streamed data records. Compared random scheme, scheme produces less overlap between groups streamed records, but contrary what expected, reduced overlap does translate into better query performance. contrast, local indices prove much more beneficial query performance. believe experience reported paper valuable practitioners researchers alike interested building database systems high velocity multidimensional data. "
Electron thermal transport via Variable Range Hopping MoSe$_{2}$ single crystals,"Bulk single crystal Molybdenum diselenide studied electronic thermal transport properties. perform resistivity measurements current plane (CIP) current perpendicular plane (CPP) function temperature. CIP measurements exhibit metal semiconductor transition $\simeq 31$ K. semiconducting phase ($T > 31$ K), transport best explained variable range hopping (VRH) model. Large magnitude resistivity CPP mode indicates strong structural anisotropy. Seebeck coefficient function temperature measured range $90 300$ K, agrees well VRH model. room temperature Seebeck coefficient found $139$ $\mu$V/K. VRH fittings resistivity Seebeck coefficient data indicate high degree localization."
Ball double hoop: demonstration model numerical optimal control," Ball hoop system well known model education linear control systems. paper, look system another perspective show suitable demonstration more advanced control techniques. contrast standard use, describe dynamics system full length; addition mode ball rolls (outer) hoop consider mode ball drops out hoop enters free fall mode. Furthermore, add another (inner) hoop center upon ball land free fall mode. constitutes another mode hybrid description system. present two challenging tasks model show they solved trajectory generation stabilization. describe model built experimentally verify validity approach solving proposed tasks. "
Forecasting market states," propose novel methodology define, analyse forecast market states. approach market states identified reference sparse precision matrix vector expectation values. procedure each multivariate observation associated given market state accordingly penalized likelihood maximization. procedure made computationally very efficient used large number assets. demonstrate procedure successfully classifies different states markets unsupervised manner. particular, describe experiment one hundred log returns two states methodology automatically associates one state periods average positive returns other state periods average negative returns, therefore discovering spontaneously common classification `bull' `bear' markets. another experiment, again one hundred log returns two states, demonstrate procedure efficiently used forecast off sample future market states significant prediction accuracy. methodology opens way range applications risk management trading strategies correlation structure plays central role. "
Planetary Ring Dynamics  Streamline Formalism  2. Theory Narrow Rings Sharp Edges," present material covers features large scale ring dynamics perturbed flows addressed part 1 (astro ph/1606.00759); includes extensive coverage all kinds ring modes dynamics (except density waves covered part 1), origin ring eccentricities mode amplitudes, issue ring/gap confinement. still leaves aside number important dynamical issues relating ring small scale structure, most notably dynamics self gravitational wakes, local viscous overstabilities ballistic transport processes. material designed self contained, 30% overlap part 1. work constitutes preprint Chapter 11 forthcoming Cambridge University book rings (Planetary Ring Systems, Matt Tiscareno Carl Murray, eds)."
Parallel Streaming Wasserstein Barycenters," Efficiently aggregating data different sources challenging problem, particularly samples each source distributed differently. These differences inherent inference task present other reasons: sensors sensor network may placed far apart, affecting their individual measurements. Conversely, computationally advantageous split Bayesian inference tasks across subsets data, but data need identically distributed across subsets. One principled way fuse probability distributions via lens optimal transport: Wasserstein barycenter single distribution summarizes collection input measures while respecting their geometry. However, computing barycenter scales poorly requires discretization all input distributions barycenter itself. Improving situation, present scalable, communication efficient, parallel algorithm computing Wasserstein barycenter arbitrary distributions. algorithm operate directly continuous input distributions optimized streaming data. method even robust nonstationary input distributions produces barycenter estimate tracks input measures time. algorithm semi discrete, needing discretize barycenter estimate. best knowledge, provide first bounds quality approximate barycenter discretization becomes finer. Finally, demonstrate practical effectiveness method, both tracking moving distributions sphere, well large scale Bayesian inference task. "
Lecar's visual comparison method assess randomness Bode's law: answer, usual main objection against any attempt finding physical cause planet distance distribution based assumption similar distance distribution could obtained sequences random numbers. assumption stated Lecar old paper (1973). show here assumption incorrect his visual comparison method inappropriate.
GoDP: Globally optimized dual pathway system facial landmark localization   wild,"Facial landmark localization fundamental module pose invariant face recognition. most common approach facial landmark detection cascaded regression, composed two steps: feature extraction facial shape regression. Recent methods employ deep convolutional networks extract robust features each step, while whole system could regarded deep cascaded regression architecture. work, instead employing deep regression network, Globally Optimized Dual Pathway (GoDP) deep architecture proposed identify target pixels through solving cascaded pixel labeling problem without resorting high level inference models complex stacked architecture. proposed end end system relies distance aware softmax functions dual pathway proposal refinement architecture. Results show outperforms state of art cascaded regression based methods multiple   wild face alignment databases. model achieves 1.84 normalized mean error (NME) AFLW database, outperforms 3DDFA 61.8%. Experiments face identification demonstrate GoDP, coupled DPM headhunter, able improve rank 1 identification rate 44.2% compared Dlib toolbox challenging database."
" function support finite measure ""small"" spectrum", construct function real line supported set finite measure whose spectrum density zero. 
Cell growth rate dictates onset glass fluid like transition long time super diffusion evolving cell colony,"Collective migration dominates phenomena, cell movement living systems abiotic self propelling particles. Focusing early stages tumor evolution, enunciate principles involved cell dynamics highlight their implications understanding similar behavior seemingly unrelated soft glassy materials possibly chemokine induced migration CD8$^{+}$ T cells. performed simulations tumor invasion using minimal three dimensional model, accounting cell elasticity adhesive cell cell interactions well cell birth death establish cell growth rate dependent tumor expansion results emergence distinct topological niches. Cells periphery move higher velocity perpendicular tumor boundary, while motion interior cells slower isotropic. mean square displacement, $\Delta(t)$, cells exhibits glassy behavior times comparable cell cycle time, while exhibiting super diffusive behavior, $\Delta (t) \approx t^{\alpha}$ ($\alpha > 1$), longer times. derive value $\alpha \approx 1.33$ using field theoretic approach based stochastic quantization. process establish universality super diffusion class seemingly unrelated non equilibrium systems. Super diffusion long times arises if imbalance between cell birth death rates. findings collective migration, suggests tumor evolution occurs polarized manner, quantitative agreement {\  vitro} experiments. Although set context tumor invasion findings should hold describing collective motion growing cells active systems creation annihilation particles play role."
Distributed Average Tracking Lipschitz Type Nonlinear Dynamical Systems," paper, distributed average tracking problem studied Lipschitz type nonlinear dynamical systems. objective design distributed average tracking algorithms locally interactive agents track average multiple reference signals. Here, both agents' reference signals' dynamics, nonlinear term satisfying Lipschitz type condition. Three types distributed average tracking algorithms designed. First, based state dependent gain designing approaches, robust distributed average tracking algorithm developed solve distributed average tracking problems without requiring same initial condition. Second, using gain adaption scheme, adaptive distributed average tracking algorithm proposed paper remove requirement Lipschitz constant known agents. Third, reduce chattering make algorithms easier implement, continuous distributed average tracking algorithm based time varying boundary layer further designed continuous approximation previous discontinuous distributed average tracking algorithms. "
  Möbius Function Topology General Pattern Posets," introduce formal definition pattern poset encompasses several previously studied posets literature. Using definition present general results Möbius function topology pattern posets. prove results using poset fibration based embeddings poset, embeddings representations occurrences. show Möbius function these posets intrinsically linked number embeddings, particular so called normal embeddings. present results topological properties Cohen Macaulayness shellability preserved fibration. Furthermore, apply these results pattern posets derive alternative proofs existing results, Björner's results subword order. "
 Potapov type approach truncated matricial Stieltjes type power moment problem, paper gives parametrization solution set matricial Stieltjes type truncated power moment problem non degenerate degenerate cases. key role plays solution corresponding system Potapov's fundamental matrix inequalities. 
 scaling limit KPZ equation space dimension 3 higher," study present article Kardar Parisi Zhang (KPZ) equation $$ \partial_t h(t,x)=\nu\Delta h(t,x)+\lambda |\nabla h(t,x)|^2 +\sqrt{D}\, \eta(t,x), \qquad (t,x)\ \mathbb{R}_+\times\mathbb{R}^d $$ $d\ge 3$ dimensions perturbative regime, i.e. $\lambda>0$ small enough smooth, bounded, integrable initial condition $h_0=h(t=0,\cdot)$. forcing term $\eta$ right hand side regularized space time white noise. exponential $h$  so called Cole Hopf transform  known satisfy linear PDE multiplicative noise. prove large scale diffusive limit solution, particular time integrated heat kernel behavior covariance parabolic scaling. proof based rigorous implementation K. Wilson's renormalization group scheme. double cluster/momentum decoupling expansion allows perturbative estimates bare resolvent Cole Hopf linear PDE small field region noise too large, following broad lines Iagolnitzer Magnen. Standard large deviation estimates $\eta$ make possible extend above estimates large field region. Finally, show, resumming all by products expansion, solution $h$ may written large scale limit (after suitable Galilei transformation) small perturbation solution underlying linear Edwards Wilkinson model ($\lambda=0$) renormalized coefficients $\nu_{eff}=\nu+O(\lambda^2),D_{eff}=D+O(\lambda^2)$."
Beyond Free Riding: Quality Indicators Assessing Participation Information Sharing Threat Intelligence," Threat intelligence sharing become growing concept, whereby entities exchange patterns threats each other, form indicators, community trust threat analysis incident response. However, sharing threat related information posed various risks organization pertains security, privacy, competitiveness. Given coinciding benefits risks threat information sharing, entities adopted elusive behavior ""free riding"" so they acquire benefits sharing without contributing much community. So far, understanding effectiveness sharing viewed perspective amount information exchanged opposed quality. paper, introduce notion quality indicators (\qoi) assessment level contribution participants information sharing threat intelligence. exemplify notion through various metrics, including correctness, relevance, utility, uniqueness indicators. order realize notion \qoi, conducted empirical study taken benchmark approach define quality metrics, then obtained reference dataset utilized tools machine learning literature quality assessment. compared these results against model considers volume information metric contribution, unveiled various interesting observations, including ability spot low quality contributions synonym free riding threat information sharing. "
  Design LQR Kernels Efficient Controller Learning," Finding optimal feedback controllers nonlinear dynamic systems data hard. Recently, Bayesian optimization (BO) proposed powerful framework direct controller tuning experimental trials. selecting next query point finding global optimum, BO relies probabilistic description latent objective function, typically Gaussian process (GP). shown herein, GPs common kernel choice , however, lead poor learning outcomes standard quadratic control problems. first order system, construct two kernels specifically leverage structure well known Linear Quadratic Regulator (LQR), retain flexibility Bayesian nonparametric learning. Simulations uncertain linear nonlinear systems demonstrate LQR kernels yield superior learning performance. "
