Closed form Marginal Likelihood Gamma Poisson Matrix Factorization," present novel understandings Gamma Poisson (GaP) model, probabilistic matrix factorization model count data. show GaP rewritten free score/activation matrix. gives new insights about estimation topic/dictionary matrix maximum marginal likelihood estimation. particular, explains robustness estimator specified values factorization rank, especially ability automatically prune irrelevant dictionary columns, empirically observed previous work. marginalization activation matrix leads turn new Monte Carlo Expectation Maximization algorithm favorable properties. "
Laboratory mid IR spectra equilibrated igneous meteorites. Searching observables planetesimal debris," Meteorites contain minerals Solar System asteroids different properties (like size, presence water, core formation). provide new mid IR transmission spectra powdered meteorites obtain templates mid IR spectra asteroidal debris would look like. essential interpreting mid IR spectra past future space observatories, like James Webb Space Telescope. show transmission spectra wet dry chondrites, carbonaceous ordinary chondrites achondrite chondrite meteorites distinctly different way one distinguish astronomical mid IR spectra. two observables spectroscopically separate different meteorites groups (and thus different types parent bodies) pyroxene olivine feature strength ratio peak shift olivine spectral features due increase iron concentration olivine. "
Case Static AMSDU Aggregation WLANs," Frame aggregation mechanism multiple frames combined into single transmission unit air. Frames aggregated AMSDU level use common CRC check enforce integrity. longer aggregated AMSDU frames, packet error rate increases significantly same bit error rate. Hence, multiple studies proposed doing AMSDU aggregation adaptively based error rate. study evaluates if \emph{practical} advantage doing adaptive AMSDU aggregation based link bit error rate. Evaluations model show instead implementing complex adaptive AMSDU frame aggregation mechanism impact queuing other implementation aspects, easier influence packet error rate traditional mechanisms while keeping AMSDU aggregation logic simple. "
 $Gaia$ ESO Survey: inner disk intermediate age open cluster NGC 6802,"Milky Way open clusters very diverse terms age, chemical composition, kinematic properties. Intermediate age old open clusters less common, even harder find them inside solar Galactocentric radius, due high mortality rate strong extinction inside region. NGC 6802 one inner disk open clusters (IOCs) observed $Gaia$ ESO survey (GES). cluster important target calibrating abundances derived survey due kinematic chemical homogeneity members open clusters. Using measurements $Gaia$ ESO internal data release 4 (iDR4), identify 95 main sequence dwarfs cluster members GIRAFFE target list, eight giants cluster members UVES target list. dwarf cluster members median radial velocity $13.6\pm1.9$ km s$^{ 1}$, while giant cluster members median radial velocity $12.0\pm0.9$ km s$^{ 1}$ median [Fe/H] $0.10\pm0.02$ dex. color magnitude diagram these cluster members suggests age $0.9\pm0.1$ Gyr, $(m M)_0=11.4$ $E(B V)=0.86$. perform first detailed chemical abundance analysis NGC 6802, including 27 elemental species. gain more general picture about IOCs, measurements NGC 6802 compared those other IOCs previously studied GES, is, NGC 4815, Trumpler 20, NGC 6705, Berkeley 81. NGC 6802 shows similar C, N, Na, Al abundances other IOCs. These elements compared nucleosynthetic models function cluster turn off mass. $\alpha$, iron peak, neutron capture elements explored self consistent way."
Witness Functions versus Interpretation Functions Secrecy Cryptographic Protocols: What Choose?," Proving cryptographic protocol correct secrecy hard task. One strongest strategies reach goal show increasing, means security level every single atomic message exchanged protocol, safely evaluated, never deceases. Recently, two families functions proposed measure security level atomic messages. first one family interpretation functions. second family witness functions. paper, show witness functions more efficient interpretation functions. give detailed analysis ad hoc protocol witness functions succeed proving correctness secrecy while interpretation functions fail so. "
Pairwise Difference Estimation High Dimensional Partially Linear Model," paper proposes regularized pairwise difference approach estimating linear component coefficient partially linear model, consistency exact rates convergence obtained high dimensions under mild scaling requirements. analysis reveals interesting features (i) bandwidth parameter automatically adapts model actually tuning insensitive; (ii) procedure could even maintain fast rate convergence $\alpha$ Hölder class $\alpha\leq1/2$. Simulation studies show advantage proposed method, application approach brain imaging data reveals biological patterns fail recovered using competing methods."
Dissecting multivariate extremal index tail dependence," central issue theory extreme values focuses suitable conditions well known results limiting distributions maximum i.i.d. sequences applied stationary ones. context, extremal index appears key parameter capture effect temporal dependence limiting distribution maxima. multivariate extremal index corresponds generalization concept multivariate context affects tail dependence structure within marginal sequences between them. function, inference becomes more difficult, therefore important obtain characterizations, namely bounds based marginal dependence easier estimate. work present two decompositions emphasize different types information contained multivariate extremal index, upper limit better those found literature analyze role dependence limiting model componentwise maxima stationary sequence. will illustrate results examples recognized interest applications. "
"Big Universe, Big Data: Machine Learning Image Analysis Astronomy"," Astrophysics cosmology rich data. advent wide area digital cameras large aperture telescopes led ever more ambitious surveys sky. Data volumes entire surveys decade ago now acquired single night real time analysis often desired. Thus, modern astronomy requires big data know  , particular demands highly efficient machine learning image analysis algorithms. But scalability challenge: Astronomy applications touch several current machine learning research questions, learning biased data dealing label measurement noise. argue makes astronomy great domain computer science research, pushes boundaries data analysis. following, will present exciting application area data scientists. will focus exemplary results, discuss main challenges, highlight recent methodological advancements machine learning image analysis triggered astronomical applications. "
Natural Language Does Emerge 'Naturally' Multi Agent Dialog," number recent works proposed techniques end end learning communication protocols among cooperative multi agent populations, simultaneously found emergence grounded human interpretable language protocols developed agents, all learned without any human supervision! paper, using Task Tell reference game between two agents testbed, present sequence 'negative' results culminating 'positive' one  showing while most agent invented languages effective (i.e. achieve near perfect task rewards), they decidedly interpretable compositional. essence, find natural language does emerge 'naturally', despite semblance ease natural language emergence one may gather recent literature. discuss possible coax invented languages become more more human like compositional increasing restrictions two agents may communicate. "
Properties Origin Galaxy Velocity Bias Illustris Simulation," use hydrodynamical galaxy formation simulations Illustris suite study origin properties galaxy velocity bias, i.e., difference between velocity distributions galaxies dark matter inside halos. find galaxy velocity bias decreasing function ratio galaxy stellar mass host halo mass. general, central galaxies rest respect dark matter halos core halos, velocity dispersion above 0.04 times dark matter. central galaxy velocity bias found mostly caused close interactions between central satellite galaxies. satellite galaxies, velocity bias related their dynamical tidal evolution history after being accreted onto host halos. depends time after accretion their distances halo centers, massive satellites generally moving more slowly dark matter. results broad agreements those inferred modeling small scale redshift space galaxy clustering data, study help improve models redshift space galaxy clustering."
Computer Modeling Halogen Bonds Other $σ$ Hole Interactions,"  field noncovalent interactions new paradigm recently become popular. stems analysis molecular electrostatic potentials introduces label, recently attracted enormous attention. label {\sigma} hole, first used connection halogens. initiated renaissance interest halogenated compounds, later  , found other groups atoms (chalcogens, pnicogens, tetrels aerogens), resulted new direction research intermolecular interactions. review, summarize advances about last 10 years understanding those interactions related {\sigma} hole. pay particular attention theoretical computational techniques, play crucial role field."
Towards Universal End End Affect Recognition Multilingual Speech ConvNets," propose end end affect recognition approach using Convolutional Neural Network (CNN) handles multiple languages, applications emotion personality recognition speech. lay foundation universal model trained multiple languages once. affect shared across all languages, able leverage shared information between languages improve overall performance each one. obtained average improvement 12.8% emotion 10.1% personality compared same model trained each language  . end end because directly take narrow band raw waveforms input. allows accept input audio recorded any source avoid overhead information loss feature extraction. outperforms similar CNN using spectrograms input 12.8% emotion 6.3% personality, based F scores. Analysis network parameters layers activation shows network learns extracts significant features first layer, particular pitch, energy contour variations. Subsequent convolutional layers instead capture language specific representations through analysis supra segmental features. model represents important step development fully universal affect recognizer, able recognize additional descriptors, stress, future implementation into affective interactive systems."
 Variational Characterization Fluid Sloshing Surface Tension," consider sloshing problem incompressible, inviscid, irrotational fluid open container, including effects due surface tension free surface. restrict ourselves constant contact angle seek time harmonic solutions linearized problem, describes time evolution fluid due small initial disturbance surface rest. opposed zero surface tension case, problem reduces partial differential equation velocity potential, obtain coupled system velocity potential free surface displacement. derive new variational formulation coupled problem establish existence solutions using direct method calculus variations. prove domain monotonicity result fundamental sloshing eigenvalue. limit zero surface tension, recover variational formulation mixed Steklov Neumann eigenvalue problem give first order perturbation formula simple eigenvalue. "
diagnoseIT: Expertengestützte automatische Diagnose von Performance Probleme Enterprise Anwendungen (Abschlussbericht), final report collaborative research project diagnoseIT expert guided automatic diagnosis performance problems enterprise applications. 
Statistical Inference Political Networks Research," Researchers interested statistically modeling network data well established quickly growing set approaches choose. Several these methods regularly applied research political networks, while permeate field. Here, review most prominent methods inferential network analysis both cross sectionally longitudinally observed networks including (temporal) exponential random graph models, latent space models, quadratic assignment procedure, stochastic actor oriented models. each method, summarize analytic form, identify prominent published applications political science discuss computational considerations. conclude set guidelines selecting method given application. "
Controller jammer game models Denial Service control systems operating packet dropping links," paper introduces class zero sum games between adversary controller scenario `denial service' networked control system. communication link modeled set transmission regimes controlled strategic jammer whose intention wage attack plant choosing most damaging regime switching strategy. demonstrate even one step case, introduced games admit saddle point equilibrium, jammer's optimal policy randomize region plant's state space, thus requiring controller undertake nontrivial response different what one would expect standard stochastic control problem packet dropping link. paper derives conditions introduced games saddle point equilibrium. Furthermore, show more general multi stage games, these conditions provide `greedy' jamming strategies adversary. "
Conservation spin supercurrents superconductors," demonstrate spin supercurrents conserved upon transmission through conventional superconductor, even presence spin dependent scattering impurities magnetic moments spin orbit coupling. fundamentally different conventional spin currents, decay presence scattering, important implications usage superconducting materials spintronic hybrid structures. "
Driver Identification Using Automobile Sensor Data Single Turn," automotive electronics continue advance, cars becoming more more reliant sensors perform everyday driving operations. These sensors omnipresent help car navigate, reduce accidents, provide comfortable rides. However, they used learn about drivers themselves. paper, propose method predict, sensor data collected single turn, identity driver out given set individuals. cast problem terms time series classification, dataset contains sensor readings one turn, repeated several times multiple drivers. build classifier find unique patterns each individual's driving style, visible data even short road segment. test approach, analyze new dataset collected AUDI AG Audi Electronics Venture, fleet test vehicles equipped automotive data loggers storing all sensor readings real roads. show turns particularly well suited detecting variations across drivers, especially compared straightaways. then focus 12 most frequently made turns dataset, include rural, urban, highway ramps, more, obtaining accurate identification results learning useful insights about driver behavior variety settings."
Same different problems strain convolutional neural networks," robust efficient recognition visual relations images hallmark biological vision. argue , despite recent progress visual recognition, modern machine vision algorithms severely limited their ability learn visual relations. Through controlled experiments, demonstrate visual relation problems strain convolutional neural networks (CNNs). networks eventually break altogether rote memorization becomes impossible, intra class variability exceeds network capacity. Motivated comparable success biological vision, argue feedback mechanisms including attention perceptual grouping may key computational components underlying abstract visual reasoning.\ "
Hyper dimensional computing visual question answering system trainable end end," work propose system visual question answering. architecture composed two parts, first part creates logical knowledge base given image. second part evaluates questions against knowledge base. Differently previous work, knowledge base represented using hyper dimensional computing. choice advantage all operations system, namely creating knowledge base evaluating questions against  , differentiable, thereby making system easily trainable end end fashion. "
 Inner Structure Time Dependent Signals," paper shows time series measurements evolving system processed create inner time series unaffected any instantaneous invertible, possibly nonlinear transformation measurements. inner time series contains information does depend nature sensors, observer chose monitor system. Instead, encodes information intrinsic evolution observed system. Because sensor independence, inner time series may produce fewer false negatives used detect events presence sensor drift. Furthermore, if observed physical system comprised non interacting subsystems, inner time series separable; i.e., consists collection time series, each one being inner time series isolated subsystem. Because property, inner time series used detect specific behavior one independent subsystems without using blind source separation disentangle subsystem . method illustrated applying : 1) analytic example; 2) audio waveform one speaker; 3) video images moving camera; 4) mixtures audio waveforms two speakers."
Classical properties leading eigenstates quantum dissipative systems," analyzing paradigmatic example theory dissipative systems  classical quantum dissipative standard map  able explain main features decay quantum equilibrium state. classical isoperiodic stable structures typically present parameter space these kind systems play fundamental role. fact, found period stable structures near space determines phase leading eigenstates corresponding quantum superoperator. Moreover, eigenvectors show strong localization corresponding periodic orbits (limit cycles). show sort scarring phenomenon ( established property Hamiltonian projectively open systems) present dissipative case extreme simplicity. "
Towards Binary Valued Gates Robust LSTM Training,"Long Short Term Memory (LSTM) one most widely used recurrent structures sequence modeling. aims use gates control information flow (e.g., whether skip information ) recurrent computations, although practical implementation based soft gates partially achieves goal. paper, propose new way LSTM training, pushes output values gates towards 0 1. doing so, better control information flow: gates mostly open closed, instead middle state, makes results more interpretable. Empirical studies show (1) Although seems restrict model capacity, no performance drop: achieve better comparable performances due better generalization ability; (2) outputs gates sensitive their inputs: easily compress LSTM unit multiple ways, e.g., low rank approximation low precision approximation. compressed models even better baseline models without compression."
GUB Covers Power Indexed formulations Wireless Network Design," propose pure 0 1 formulation wireless network design problem, i.e. problem configuring set transmitters provide service coverage set receivers. contrast classical mixed integer formulations, power emissions represented continuous variables, consider finite set powers values. two major advantages: better fits usual practice eliminates sources numerical problems heavily affect continuous models. crucial ingredient approach effective basic formulation single knapsack problem representing coverage condition receiver. formulation based GUB cover inequalities introduced Wolsey (1990) core extension exact formulation GUB knapsack polytope two GUB constraints. special case corresponds very common practical situation one major interferer present. assess effectiveness formulation comprehensive computational results realistic instances two typical technologies, namely WiMAX DVB T."
Orbital contributions electron g factor semiconductor nanowires,"Recent experiments Majorana fermions semiconductor nanowires [Albrecht et al., Nat. 531, 206 (2016)] revealed surprisingly large electronic Landé g factor, several times larger bulk value contrary expectation confinement reduces g factor. Here assess role orbital contributions electron g factor nanowires quantum dots. show LS coupling higher subbands leads enhancement g factor order magnitude more small effective mass semiconductors. validate theoretical finding simulations InAs InSb, showing effect persists even if cylindrical symmetry broken. huge anisotropy enhanced g factors under magnetic field rotation allows straightforward experimental test theory."
Comprehensive routing strategy multilayer networks," Designing efficient routing strategy great importance alleviate traffic congestion multilayer networks. work, design effective routing strategy multilayer networks comprehensively considering roles nodes' local structures micro level, well macro level differences transmission speeds between different layers. Both numerical analytical results indicate proposed routing strategy reasonably redistribute traffic load low speed layer high speed layer, thus traffic capacity multilayer networks significantly enhanced compared monolayer low speed networks. optimal combination macro  micro level control parameters remarkably alleviate congestion thus maximize traffic capacity given multilayer network. Moreover, find increasing size average degree high speed layer enhance traffic capacity multilayer networks more effectively. finally verify real world network topology does invalidate results. theoretical predictions agree well numerical simulations. "
Long short term memory learning learn networks spiking neurons,"Recurrent networks spiking neurons (RSNNs) underlie astounding computing learning capabilities brain. But computing learning capabilities RSNN models remained poor, least comparison artificial neural networks (ANNs). address two possible reasons . One RSNNs brain randomly connected designed according simple rules, they start learning tabula rasa network. Rather, RSNNs brain optimized their tasks through evolution, development, prior experience. Details these optimization processes largely unknown. But their functional contribution approximated through powerful optimization methods, backpropagation through time (BPTT). second major mismatch between RSNNs brain models latter show small fraction dynamics neurons synapses brain. include neurons RSNN model reproduce one prominent dynamical process biological neurons takes place behaviourally relevant time scale seconds: neuronal adaptation. denote these networks LSNNs because their Long short term memory. inclusion adapting neurons drastically increases computing learning capability RSNNs if they trained configured deep learning (BPTT combined rewiring algorithm optimizes network architecture). fact, computational performance these RSNNs approaches first time LSTM networks. addition RSNNs adapting neurons acquire abstract knowledge prior learning Learning Learn (L2L) scheme, transfer knowledge order learn new but related tasks very few examples. demonstrate supervised learning reinforcement learning."
Detecting Molecular Rotational Dynamics Complementing Low Frequency Terahertz Vibrations Zirconium Based Metal Organic Framework," show clear experimental evidence co operative terahertz (THz) dynamics observed below 3 THz (~100 cm 1), low symmetry Zr based metal organic framework (MOF) structure, termed MIL 140A [ZrO(O2C C6H4 CO2)]. Utilizing combination high resolution inelastic neutron scattering synchrotron radiation far infrared spectroscopy, measured low energy vibrations originating hindered rotations organic linkers, whose energy barriers detailed dynamics elucidated via ab initio density functional theory (DFT) calculations. completeness, obtained Raman spectra characterized alterations complex pore architecture caused THz rotations. discovered array soft modes trampoline like motions, could potentially source anomalous mechanical phenomena, negative linear compressibility negative thermal expansion. results demonstrate coordinated shear dynamics (~2.5 THz), mechanism shown destabilize MOF crystals, exact crystallographic direction minimum shear modulus (Gmin)."
 southern sky total intensity source catalogue 2.3 GHz S band Polarisation All Sky Survey data," S band Polarisation All Sky Survey (S PASS) observed entire southern sky using 64 metre Parkes radio telescope 2.3GHz effective bandwidth 184MHz. surveyed sky area covers all declinations $\delta\leq 0^\circ$. analyse compact sources survey data re processed produce set 107 Stokes $I$ maps 10.75arcmin resolution large scale emission contribution filtered out. paper use these Stokes $I$ images create total intensity southern sky extragalactic source catalogue 2.3GHz. source catalogue contains 23,389 sources covers sky area 16,600deg$^2$, excluding Galactic plane latitudes $|b|<10^\circ$. Approximately 8% catalogued sources resolved. S PASS source positions typically accurate within 35arcsec. flux density 225mJy S PASS source catalogue more 95% complete, $\sim$94% S PASS sources brighter 500mJy beam$^{ 1}$ counterpart lower frequencies."
